Sheet: с
A1: Reversed left context | B1: Reversed center | C1: Left context | D1: Center | E1: Punct | F1: Right context | G1: Title | H1: Author | I1: Birthday | J1: Header | K1: Created | L1: Sphere | M1: Type | N1: Topic | O1: Publication | P1: Publ_year | Q1: Medium | R1: Ambiguity | S1: Full context
A2: ен сав я мек с | B2: латупс | C2: с кем я вас не | D2: спутал | E2: , ― | F2: говорит. | G2: Михаил Панин. Камикадзе // «Звезда», 2002 | H2: Михаил Панин | J2: Камикадзе | K2: 2002 | L2: художественная | M2: роман | O2: «Звезда» | P2: 2002 | Q2: журнал | R2: омонимия не снята | S2: ― Ни с кем я вас не спутал, ― говорит. [Михаил Панин. Камикадзе // «Звезда», 2002] [омонимия не снята] | T2: =INT(RAND()*50) -> 22 | U2: =IF(R[1]C[-13]=RC[-13],) -> 0 | V2: =INT(RAND()*25) -> 20
A3: ончоран возохлок едяр в тяровоГ | B3: илатупс | C3: Говорят, в ряде колхозов нарочно | D3: спутали | F3: хорошее зерно с отходами, чтобы | G3: Анастас Микоян. Так было (1971-1974) | H3: Анастас Микоян | I3: 1895 | J3: Так было | K3: 1971-1974 | L3: публицистика , нехудожественная | M3: мемуары | O3: Анастас Микоян. Так было | P3: 1999 | Q3: книга | R3: омонимия не снята | S3: Говорят, в ряде колхозов нарочно спутали хорошее зерно с отходами, чтобы после разговора о заготовках иметь это как ресурсы для маневрирования. [Анастас Микоян. Так было (1971-1974)] [омонимия не снята] | T3: =INT(RAND()*50) -> 33 | U3: =IF(R[1]C[-13]=RC[-13],) -> 0 | V3: =INT(RAND()*25) -> 1
A4: ен никшыМ йыроток солог йикснеж | B4: латупс | C4: женский голос, который Мышкин не | D4: спутал | F4: бы ни с каким другим | G4: Вера Белоусова. Жил на свете рыцарь бедный (2000) | H4: Вера Белоусова | I4: 1958 | J4: Жил на свете рыцарь бедный | K4: 2000 | L4: художественная | M4: роман | O4: Вера Белоусова. «Жил на свете рыцарь бедный» | P4: 2000 | Q4: книга | R4: омонимия не снята | S4: ― Я хотела бы поговорить с… господином Мышкиным, ― с легкой запинкой произнес женский голос, который Мышкин не спутал бы ни с каким другим. [Вера Белоусова. Жил на свете рыцарь бедный (2000)] [омонимия не снята] | T4: =INT(RAND()*50) -> 47 | U4: =IF(R[1]C[-13]=RC[-13],) -> 0 | V4: =INT(RAND()*25) -> 17
A5: илсым укылатнап с либс имигортс | B5: латупс | C5: строгими сбил с панталыку, мысли | D5: спутал | E5: , | F5: суровым, грозным: | G5: Сергей Солоух. Клуб одиноких сердец унтера Пришибеева (1991-1995) | H5: Сергей Солоух | I5: 1959 | J5: Клуб одиноких сердец унтера Пришибеева | K5: 1991-1995 | L5: художественная | M5: роман | O5: Сергей Солоух. Клуб одиноких сердец унтера Пришибеева | P5: 2002 | Q5: книга | R5: омонимия не снята | S5: Хорошо, Шурка Лыткин, одноклассник, фэн, свидетель и участник «тех самых» развеселых танцев, студент-механик ныне, как раз в этот самый вечер дежурил в раздевалке, услышал шум, из амбразуры выскочил, оттер майора отставного, словами правильными, строгими сбил с панталыку, мысли спутал, суровым, грозным: [Сергей Солоух. Клуб одиноких сердец унтера Пришибеева (1991-1995)] [омонимия не снята] | T5: =INT(RAND()*50) -> 25 | U5: =IF(R[1]C[-13]=RC[-13],) -> 0 | V5: =INT(RAND()*25) -> 16
A6: ен меч с ин йыроток | B6: ьшеатупс | C6: который ни с чем не | D6: спутаешь | E6: , | F6: единожды услышав, ― это был крик | G6: Василий Голованов. Остров, или оправдание бессмысленных путешествий (2002) | H6: Василий Голованов | I6: 1960 | J6: Остров, или оправдание бессмысленных путешествий | K6: 2002 | L6: публицистика , нехудожественная | M6: монография | N6: путешествия | O6: В. Голованов. Остров, или оправдание бессмысленных путешествий | P6: 2002 | Q6: книга | R6: омонимия не снята | S6: Я начал подниматься наверх, как вдруг услышал крик, который ни с чем не спутаешь, единожды услышав, ― это был крик сокола-сапсана! [Василий Голованов. Остров, или оправдание бессмысленных путешествий (2002)] [омонимия не снята] | T6: =INT(RAND()*50) -> 29 | U6: =IF(R[1]C[-13]=RC[-13],) -> 0 | V6: =INT(RAND()*25) -> 3
A7: ен огондо ин и огогурд | B7: ьшеатупс | C7: другого; и ни одного не | D7: спутаешь | F7: с другим. | G7: М. Л. Гаспаров. Занимательная Греция (1998) | H7: М. Л. Гаспаров | I7: 1935 | J7: Занимательная Греция | K7: 1998 | L7: учебно-научная , нехудожественная | M7: монография | N7: наука и технологии, история, искусство и культура | O7: М. Л. Гаспаров. Занимательная Греция | P7: 1998 | Q7: книга | R7: омонимия не снята | S7: Пять поэтов, пять отрывков, один короче другого; и ни одного не спутаешь с другим. [М. Л. Гаспаров. Занимательная Греция (1998)] [омонимия не снята] | T7: =INT(RAND()*50) -> 36 | U7: =IF(R[1]C[-13]=RC[-13],) -> 0 | V7: =INT(RAND()*25) -> 2
A8: я ен отЭ | B8: алатупс | C8: ― Это не я | D8: спутала | E8: , | F8: это он перепутал. | G8: Анна Ларина (Бухарина). Незабываемое (1986-1990) | H8: Анна Ларина (Бухарина) | I8: 1914 | J8: Незабываемое | K8: 1986-1990 | L8: публицистика , нехудожественная | M8: мемуары | O8: Анна Ларина-Бухарина. Незабываемое | P8: 2002 | Q8: книга | R8: омонимия не снята | S8: ― Это не я спутала, это он перепутал. [Анна Ларина (Бухарина). Незабываемое (1986-1990)] [омонимия не снята] | T8: =INT(RAND()*50) -> 14 | U8: =IF(R[1]C[-13]=RC[-13],) -> 0 | V8: =INT(RAND()*25) -> 20
A9: умомидив-оп мотэ ирП | B9: илатупс | C9: При этом, по-видимому, | D9: спутали | F9: русское зарубежье с зарубежьем вообще | G9: Ольга Славникова. Ландшафты хеппи-энда // «Октябрь», 2001 | H9: Ольга Славникова | I9: 1957 | J9: Ландшафты хеппи-энда | K9: 2001 | L9: публицистика , нехудожественная | M9: статья | N9: искусство и культура | O9: «Октябрь» | P9: 2001 | Q9: журнал | R9: омонимия не снята | S9: При этом, по-видимому, спутали русское зарубежье с зарубежьем вообще, а «возвращенную» литературу с тем, что реально овладевает умами по ту сторону рухнувшего железного занавеса. [Ольга Славникова. Ландшафты хеппи-энда // «Октябрь», 2001] [омонимия не снята] | T9: =INT(RAND()*50) -> 12 | U9: =IF(R[1]C[-13]=RC[-13],) -> 0 | V9: =INT(RAND()*25) -> 16
A10: но ацмен укур отч модяр | B10: латупс | C10: рядом, что руку немца он | D10: спутал | F10: с поляковской рукой. | G10: Василий Гроссман. Жизнь и судьба, часть 2 (1960) | H10: Василий Гроссман | I10: 1905 | J10: Жизнь и судьба, часть 2 | K10: 1960 | L10: художественная | M10: роман | O10: Гроссман В. Жизнь и судьба | P10: 1992 | Q10: книга | R10: омонимия снята | S10: Но сейчас он растерялся, его поразило, что, оглушённый и ослеплённый, он утешался, чувствуя немца рядом, что руку немца он спутал с поляковской рукой. [Василий Гроссман. Жизнь и судьба, часть 2 (1960)] [омонимия снята] | T10: =INT(RAND()*50) -> 31 | U10: =IF(R[1]C[-13]=RC[-13],) -> 0 | V10: =INT(RAND()*25) -> 5
A11: тежоМ аледис апарт у монофоскас | B11: илатупс | C11: саксофоном у трапа сидела. ― Может, | D11: спутали | E11: ? | F11: У нее корнет-а-пистон. | G11: Виктор Конецкий. Вчерашние заботы (1979) | H11: Виктор Конецкий | I11: 1929 | J11: Вчерашние заботы | K11: 1979 | L11: художественная | M11: повесть | O11: Конецкий В. Начало конца комедии | P11: 1990 | Q11: книга | R11: омонимия не снята | S11: ― А я на судно приехал, она с саксофоном у трапа сидела. ― Может, спутали? У нее корнет-а-пистон. [Виктор Конецкий. Вчерашние заботы (1979)] [омонимия не снята] | T11: =INT(RAND()*50) -> 0 | U11: =IF(R[1]C[-13]=RC[-13],) -> 0 | V11: =INT(RAND()*25) -> 15
A12: ен ыб монацап с откин | B12: латупс | C12: никто с пацаном бы не | D12: спутал | E12: . | G12: Марина Зосимкина. Ты проснешься. Книга первая (2015) | H12: Марина Зосимкина | J12: Ты проснешься. Книга первая | K12: 2015 | L12: художественная | M12: роман | O12: М. Зосимкина. Ты проснешься. Монреаль: Accent Graphics Communications | P12: 2015 | Q12: книга | R12: омонимия не снята | S12: Естественно, Катя была тут не единственная девушка-стрелок, но, к примеру, у Олеси этих проблем не было, поскольку Олеся имела такие ярко выраженные формы ― что сзади, что сбоку, что спереди, ― что даже в одеянии буддийского монаха ее никто с пацаном бы не спутал. [Марина Зосимкина. Ты проснешься. Книга первая (2015)] [омонимия не снята] | T12: =INT(RAND()*50) -> 5 | U12: =IF(R[1]C[-13]=RC[-13],) -> 0 | V12: =INT(RAND()*25) -> 23
A13: ен я жу от ьрепет | B13: юатупс | C13: теперь-то уж я не | D13: спутаю | F13: ее ни с чем! | G13: В. Д. Пришвина. Невидимый град (1962) | H13: В. Д. Пришвина | I13: 1899 | J13: Невидимый град | K13: 1962 | L13: художественная проза | M13: роман | O13: Пришвина В. Д. Невидимый град. М.: Молодая гвардия, 2003 | P13: 2003 | Q13: книга | R13: омонимия не снята | S13: Правда, Михаил Сергеевич мой «благодетель», но любви к нему, как бы я того ни желала, ничто не может во мне пробудить: теперь-то уж я не спутаю ее ни с чем! [В. Д. Пришвина. Невидимый град (1962)] [омонимия не снята] | T13: =INT(RAND()*50) -> 37 | U13: =IF(R[1]C[-13]=RC[-13],) -> 0 | V13: =INT(RAND()*25) -> 23
A14: ен ьдеВ | B14: ьшеатупс | C14: Ведь не | D14: спутаешь | F14: между собой даже звучащие на | G14: Д. Меркулов. Концертный зал в квартире // «Наука и жизнь», 2006 | H14: Д. Меркулов | J14: Концертный зал в квартире | K14: 2006 | L14: производственно-техническая , нехудожественная | M14: статья | N14: техника | O14: «Наука и жизнь» | P14: 2006 | Q14: журнал | R14: омонимия не снята | S14: Ведь не спутаешь между собой даже звучащие на одной ноте, скажем, скрипку и гобой или гитару и фортепьяно. [Д. Меркулов. Концертный зал в квартире // «Наука и жизнь», 2006] [омонимия не снята] | T14: =INT(RAND()*50) -> 6 | U14: =IF(R[1]C[-13]=RC[-13],) -> 0 | V14: =INT(RAND()*25) -> 6
A15: ен оге отч каТ | B15: ьшеатупс | C15: Так что его не | D15: спутаешь | F15: ни с кем. | G15: Евгений Сухов. Делу конец -- сроку начало (2007) | H15: Евгений Сухов | I15: 1959 | J15: Делу конец -- сроку начало | K15: 2007 | L15: художественная | M15: роман | O15: Е. Е. Сухов. Делу конец -- сроку начало | P15: 2007 | Q15: книга | R15: омонимия не снята | S15: Так что его не спутаешь ни с кем. [Евгений Сухов. Делу конец -- сроку начало (2007)] [омонимия не снята] | T15: =INT(RAND()*50) -> 9 | U15: =IF(R[1]C[-13]=RC[-13],) -> 0 | V15: =INT(RAND()*25) -> 10
A16: кичтадереп телиб йовс ан тевто | B16: латупс | C16: ответ на свой билет, передатчик | D16: спутал | F16: канал и в двоичном коде | G16: Параллель // «Студенческий меридиан», 1985 | J16: Параллель | K16: 1985 | L16: художественная | M16: миниатюра | O16: «Студенческий меридиан» | P16: 1985 | Q16: журнал | R16: омонимия не снята | S16: ― Когда я настроился, чтобы получить ответ на свой билет, передатчик спутал канал и в двоичном коде стал выдавать мне положительные черты Наташи Ростовой и отрицательные ― Ноздрева, а затем и вовсе замолчал. [Параллель // «Студенческий меридиан», 1985] [омонимия не снята] | T16: =INT(RAND()*50) -> 9 | U16: =IF(R[1]C[-13]=RC[-13],) -> 0 | V16: =INT(RAND()*25) -> 23
A17: ыб окьлот ен но утуним | B17: латупс | C17: минуту он не только бы | D17: спутал | F17: ароматические букеты одного, другого… пятого | G17: Андрей Измайлов. Трюкач (2001) | H17: Андрей Измайлов | I17: 1953 | J17: Трюкач | K17: 2001 | L17: художественная | M17: роман | O17: Андрей Измайлов. Трюкач | P17: 2001 | Q17: книга | R17: омонимия не снята | S17: Но в сию минуту он не только бы спутал ароматические букеты одного, другого… пятого, он, хлебни глоток, не отличил бы вкус и запах от скипидара-ацетона. [Андрей Измайлов. Трюкач (2001)] [омонимия не снята] | T17: =INT(RAND()*50) -> 23 | U17: =IF(R[1]C[-13]=RC[-13],) -> 0 | V17: =INT(RAND()*25) -> 17
A18: ен овтсещус еокакин йыроток йызугрук | B18: олатупс | C18: кургузый, который никакое существо не | D18: спутало | F18: бы с настоящим куриным яйцом | G18: В. А. Солоухин. Смех за левым плечом (1989) | H18: В. А. Солоухин | I18: 1924 | J18: Смех за левым плечом | K18: 1989 | L18: художественная | M18: повесть | O18: Солоухин В. А. Смех за левым плечом: Книга прозы | P18: 1989 | Q18: книга | R18: омонимия не снята | S18: В ямке подкладыш ― яйцо, сшитое из белой тряпочки, продолговатый мячик, набитый ватой, угловатый, кургузый, который никакое существо не спутало бы с настоящим куриным яйцом, кроме самой курицы, впрочем, может быть, более снисходительной, нежели неразборчивой и глупой. [В. А. Солоухин. Смех за левым плечом (1989)] [омонимия не снята] | T18: =INT(RAND()*50) -> 10 | U18: =IF(R[1]C[-13]=RC[-13],) -> 0 | V18: =INT(RAND()*25) -> 0
A19: мокриц с ен мосач ее | B19: латупс | C19: ее часом не с цирком | D19: спутал | E19: ? | G19: Г. Г. Демидов. Оборванный дуэт (1973) | H19: Г. Г. Демидов | I19: 1908 | J19: Оборванный дуэт | K19: 1973 | L19: художественная | M19: рассказ | Q19: книга | R19: омонимия не снята | S19: ― Над щипачем, с воровскими целями посещавшим оперу, иронизировали: ― Ты ее часом не с цирком спутал? [Г. Г. Демидов. Оборванный дуэт (1973)] [омонимия не снята] | T19: =INT(RAND()*50) -> 2 | U19: =IF(R[1]C[-13]=RC[-13],) -> 0 | V19: =INT(RAND()*25) -> 6
A20: язянк огокилев оготэ либу йевоныс | B20: илатупс | C20: сыновей убил этого великого князя) | D20: спутали | F20: всё. | G20: Лариса Васильева. Озарённая // «Наука и религия», 2011 | H20: Лариса Васильева | J20: Озарённая | K20: 2011 | L20: художественная | M20: повесть | O20: «Наука и религия» | P20: 2011 | Q20: журнал | R20: омонимия не снята | S20: Едва успел встать на праведный путь князь Владимир Красное Солнышко, едва осенил он крестом Днепр, его берега, народ окрестный и себя, как злоба, зависть, алчность потомков (по слухам, один из сыновей убил этого великого князя) спутали всё. [Лариса Васильева. Озарённая // «Наука и религия», 2011] [омонимия не снята] | T20: =INT(RAND()*50) -> 1 | U20: =IF(R[1]C[-13]=RC[-13],) -> 0 | V20: =INT(RAND()*25) -> 10
A21: ен миьч с ин солог | B21: ьшеатупс | C21: голос ни с чьим не | D21: спутаешь | E21: . | G21: Михаил Чулаки. Примус // «Звезда», 2002 | H21: Михаил Чулаки | I21: 1941 | J21: Примус | K21: 2002 | L21: художественная | M21: роман | O21: «Звезда» | P21: 2002 | Q21: журнал | R21: омонимия не снята | S21: Как будто он и сам не узнал бы Шурку ― его голос ни с чьим не спутаешь. [Михаил Чулаки. Примус // «Звезда», 2002] [омонимия не снята] | T21: =INT(RAND()*50) -> 20 | U21: =IF(R[1]C[-13]=RC[-13],) -> 0 | V21: =INT(RAND()*25) -> 15
A22: ииссоР в яицюловеР онечноказ олыб | B22: алатупс | C22: было закончено. Революция в России | D22: спутала | F22: все карты. В феврале 1917 | G22: Александр Филюшкин. Рус, не спи в гробу! // «Родина», 2000 | H22: Александр Филюшкин | J22: Рус, не спи в гробу! | K22: 2000 | L22: публицистика, нехудожественная | M22: статья | N22: история, политика и общественная жизнь | O22: «Родина» | P22: 2000 | Q22: журнал | R22: омонимия не снята | S22: Противостояние германских разведок и русской контрразведки в годы Первой мировой не было закончено. Революция в России спутала все карты. В феврале 1917 года из Петроградской тюрьмы было выпущено, несмотря на все протесты контрразведки, 97 человек, арестованных по обвинению в сотрудничестве с врагом. [Александр Филюшкин. Рус, не спи в гробу! // «Родина», 2000] [омонимия не снята] | T22: =INT(RAND()*50) -> 11 | U22: =IF(R[1]C[-13]=RC[-13],) -> 0 | V22: =INT(RAND()*25) -> 8
A23: и илашемс есв икинтупС | B23: илатупс | C23: Спутники все смешали и | D23: спутали | E23: , | F23: все как-то вдруг устарело и | G23: А. Т. Твардовский. Из рабочих тетрадей (1957) // «Знамя», 1989 | H23: А. Т. Твардовский | I23: 1910 | J23: Из рабочих тетрадей | K23: 1957 | L23: бытовая, нехудожественная | M23: дневник, записные книжки | N23: частная жизнь | O23: «Знамя» | P23: 1989 | Q23: журнал | R23: омонимия не снята | S23: Спутники все смешали и спутали, все как-то вдруг устарело и стало меньше ― особенно стихи. [А. Т. Твардовский. Из рабочих тетрадей (1957) // «Знамя», 1989] [омонимия не снята] | T23: =INT(RAND()*50) -> 25 | U23: =IF(R[1]C[-13]=RC[-13],) -> 0 | V23: =INT(RAND()*25) -> 8
A24: ен огечин откин ыботч мокдяроп | B24: латупс | C24: порядком, чтобы никто ничего не | D24: спутал | E24: . | G24: Ю. П. Герман. Россия молодая. Часть первая (1952) | H24: Ю. П. Герман | I24: 1910 | J24: Россия молодая. Часть первая | K24: 1952 | L24: художественная | M24: роман | O24: Ю. Герман. Россия молодая. Книга 1 | P24: 1954 | Q24: книга | R24: омонимия не снята | S24: Полковник Снивин молчал, похлопывая коня рукой в перчатке с раструбом, смотрел за порядком, чтобы никто ничего не спутал. [Ю. П. Герман. Россия молодая. Часть первая (1952)] [омонимия не снята] | T24: =INT(RAND()*50) -> 21 | U24: =IF(R[1]C[-13]=RC[-13],) -> 0 | V24: =INT(RAND()*25) -> 11
A25: азок укверев яавичароку мозар мыджак | B25: театупс | C25: каждым разом укорачивая веревку, коза | D25: спутает | F25: себе в конце концов все | G25: Асар Эппель. Леонидова победа (1990-2000) | H25: Асар Эппель | I25: 1935 | J25: Леонидова победа | K25: 1990-2000 | L25: художественная | M25: рассказ | O25: Асар Эппель. Шампиньон моей жизни | P25: 2000 | Q25: книга | R25: омонимия не снята | S25: И если проделать все как надо, то, с каждым разом укорачивая веревку, коза спутает себе в конце концов все четыре ноги и неподвижно встанет или повалится, но истошно примется блеять, а ты уходишь куда шел, и выходит в очках Юливанна распутывать козьи ножки, а тут как раз, дымя козьей ножкой, идет Порфирий Петрович Государев и говорит: «Разводила бы ты, соседка, как вот я,живую белую мышь для одного институту, и коза ― ну ее в жердь, и жалованье дают, и крупа тебе остается!» [Асар Эппель. Леонидова победа (1990-2000)] [омонимия не снята] | T25: =INT(RAND()*50) -> 36 | U25: =IF(R[1]C[-13]=RC[-13],) -> 0 | V25: =INT(RAND()*25) -> 8
A26: уме авонс хутсаП | B26: латупс | C26: Пастух снова ему | D26: спутал | F26: ноги, но он уже не | G26: Фазиль Искандер. Сандро из Чегема (Книга 3) (1989) | H26: Фазиль Искандер | I26: 1929 | J26: Сандро из Чегема (Книга 3) | K26: 1989 | L26: художественная | M26: роман | O26: Ф. А. Искандер. «Сандро из Чегема». Кн. 3 | P26: 1989 | Q26: книга | R26: омонимия не снята | S26: Пастух снова ему спутал ноги, но он уже не собирался выпрыгивать из машины. [Фазиль Искандер. Сандро из Чегема (Книга 3) (1989)] [омонимия не снята] | T26: =INT(RAND()*50) -> 17 | U26: =IF(R[1]C[-13]=RC[-13],) -> 0 | V26: =INT(RAND()*25) -> 0

Sheet: пере
A1: Reversed left context | B1: Reversed center | C1: Left context | D1: Center | E1: Punct | F1: Right context | G1: Title | H1: Author | I1: Birthday | J1: Header | K1: Created | L1: Sphere | M1: Type | N1: Topic | O1: Publication | P1: Publ_year | Q1: Medium | R1: Ambiguity | S1: Full context
A2: мыротв ос оге акшувеД аляноп | B2: алатупереп | C2: поняла. Девушка его со вторым | D2: перепутала | E2: . | F2: Это во втором пробники Туморроу | G2: Красота, здоровье, отдых: Косметика и парфюм (форум) (2004) | J2: Красота, здоровье, отдых: Косметика и парфюм (форум) | K2: 2004 | L2: электронная коммуникация , нехудожественная | M2: форум | N2: частная жизнь | O2: Форум на eva.ru | P2: 2005 | Q2: электронный текст | R2: омонимия не снята | S2: А, я поняла. Девушка его со вторым перепутала. Это во втором пробники Туморроу давать будут. [Красота, здоровье, отдых: Косметика и парфюм (форум) (2004)] [омонимия не снята] | T2: =INT(RAND()*50) -> 27 | U2: =IF(R[1]C[-13]=RC[-13],) -> 0 | V2: =INT(RAND()*25) -> 24
A3: етещи огок ыВ | B3: илатупереП | C3: Вы кого ищете? | D3: Перепутали | E3: ? | F3: Если вы к Ибрагиму, так | G3: Андрей Волос. Дом у реки // «Новый Мир», 1998 | H3: Андрей Волос | I3: 1955 | J3: Дом у реки | K3: 1998 | L3: художественная | M3: повесть | O3: «Новый Мир» | P3: 1998 | Q3: журнал | R3: омонимия не снята | S3: Вы кого ищете? Перепутали? Если вы к Ибрагиму, так он в город уехал. [Андрей Волос. Дом у реки // «Новый Мир», 1998] [омонимия не снята] | T3: =INT(RAND()*50) -> 14 | U3: =IF(R[1]C[-13]=RC[-13],) -> 0 | V3: =INT(RAND()*25) -> 9
A4: икинбечУ анелЕ пороК | B4: илатупереп | C4: Короп Елена. Учебники | D4: перепутали | F4: с агитками. Премьер-министром назначен Сергей | G4: Елена Короп. Учебники перепутали с агитками. Премьер-министром назначен Сергей Кириенко (2001) // «Известия», 2001.08.29 | H4: Елена Короп | J4: Учебники перепутали с агитками. Премьер-министром назначен Сергей Кириенко | K4: 2001 | L4: публицистика , нехудожественная | M4: статья | N4: наука и технологии | O4: «Известия» | P4: 2001.08.29 | Q4: газета | R4: омонимия не снята | S4: Короп Елена. Учебники перепутали с агитками. Премьер-министром назначен Сергей Кириенко [Елена Короп. Учебники перепутали с агитками. Премьер-министром назначен Сергей Кириенко (2001) // «Известия», 2001.08.29] [омонимия не снята] | T4: =INT(RAND()*50) -> 22 | U4: =IF(R[1]C[-13]=RC[-13],) -> 0 | V4: =INT(RAND()*25) -> 0
A5: отсорп ано обил вокаруД булК | B5: алатупереп | C5: Клуб Дураков; либо она просто | D5: перепутала | F5: Тредьяковского и Коллинза (или меня | G5: Юлий Даниэль. Письма из заключения (1966-1970) | H5: Юлий Даниэль | I5: 1925 | J5: Письма из заключения | K5: 1966-1970 | L5: бытовая , нехудожественная | M5: письмо личное | N5: частная жизнь | O5: Юлий Даниэль. «Я всё сбиваюсь на литературу…» Письма из заключения. Стихи | P5: 2000 | Q5: книга | R5: омонимия не снята | S5: Возникло два предположения: либо это ― вступительный членский взнос от Наташки в Клуб Дураков; либо она просто перепутала Тредьяковского и Коллинза (или меня и Футмана? [Юлий Даниэль. Письма из заключения (1966-1970)] [омонимия не снята] | T5: =INT(RAND()*50) -> 36 | U5: =IF(R[1]C[-13]=RC[-13],) -> 0 | V5: =INT(RAND()*25) -> 14
A6: иревд ым тежоМ илшов утанмок | B6: илатупереп | C6: комнату вошли? Может, мы двери | D6: перепутали | E6: ? | F6: ― Нет, я точно помню: это | G6: Валентин Постников. Карандаш и Самоделкин в стране фараонов (1997) | H6: Валентин Постников | I6: 1970 | J6: Карандаш и Самоделкин в стране фараонов | K6: 1997 | L6: художественная | M6: сказка | O6: Валентин Постников. Карандаш и Самоделкин в стране фараонов | P6: 1997 | Q6: книга | R6: омонимия не снята | S6: ― Сам не пойму, ― может быть, мы не в ту комнату вошли? Может, мы двери перепутали? ― Нет, я точно помню: это та самая комната-ловушка, ― ответил уверенным тоном Дырка. [Валентин Постников. Карандаш и Самоделкин в стране фараонов (1997)] [омонимия не снята] | T6: =INT(RAND()*50) -> 34 | U6: =IF(R[1]C[-13]=RC[-13],) -> 0 | V6: =INT(RAND()*25) -> 14
A7: ынатш ад ьсилым ьтадив иовс | B7: илатупереп | C7: свои, ― видать, мылись да штаны | D7: перепутали | E7: . | G7: Василий Белов. Привычное дело (1967) | H7: Василий Белов | I7: 1932 | J7: Привычное дело | K7: 1967 | L7: художественная | M7: повесть | O7: Василий Белов. Сельские повести | P7: 1971 | Q7: книга | R7: омонимия не снята | S7: Гляжу, штаны-то у меня не свои, ― видать, мылись да штаны перепутали. [Василий Белов. Привычное дело (1967)] [омонимия не снята] | T7: =INT(RAND()*50) -> 28 | U7: =IF(R[1]C[-13]=RC[-13],) -> 0 | V7: =INT(RAND()*25) -> 11
A8: мывокивоН мигурд от-микак с оге | B8: латупереп | C8: его с каким-то другим Новиковым | D8: перепутал | E8: ― | F8: из писателей, возможно… | G8: Анатолий Найман. Все и каждый // «Октябрь», 2003 | H8: Анатолий Найман | I8: 1936 | J8: Все и каждый | K8: 2003 | L8: художественная | M8: роман | O8: «Октябрь» | P8: 2003 | Q8: журнал | R8: омонимия не снята | S8: Возможно, я его с каким-то другим Новиковым перепутал ― из писателей, возможно… [Анатолий Найман. Все и каждый // «Октябрь», 2003] [омонимия не снята] | T8: =INT(RAND()*50) -> 34 | U8: =IF(R[1]C[-13]=RC[-13],) -> 0 | V8: =INT(RAND()*25) -> 10
A9: ыритравк я а атыркто алыб | B9: латупереп | C9: была открыта, а я квартиры | D9: перепутал | E9: , | F9: ваша восьмая, а мне нужна | G9: Анатолий Трушкин. 208 избранных страниц (1990-2002) | H9: Анатолий Трушкин | I9: 1941 | J9: 208 избранных страниц | K9: 1990-2002 | L9: художественная | M9: миниатюра | O9: Анатолий Трушкин. 208 избранных страниц | P9: 1999 | Q9: книга | R9: омонимия не снята | S9: Извините, у вас дверь была открыта, а я квартиры перепутал, ваша восьмая, а мне нужна четыреста сорок четвертая. [Анатолий Трушкин. 208 избранных страниц (1990-2002)] [омонимия не снята] | T9: =INT(RAND()*50) -> 14 | U9: =IF(R[1]C[-13]=RC[-13],) -> 0 | V9: =INT(RAND()*25) -> 9
A10: яславрос от-едг от-отК | B10: латупереп | C10: Кто-то где-то сорвался, | D10: перепутал | E10: , | F10: не туда положил. | G10: Сергей Юрский. Осенний бал (1993) | H10: Сергей Юрский | I10: 1935 | J10: Осенний бал | K10: 1993 | L10: художественная | M10: письмо литературное | O10: Юрский С. Содержимое ящика | P10: 1998 | Q10: книга | R10: омонимия не снята | S10: Кто-то где-то сорвался, перепутал, не туда положил. [Сергей Юрский. Осенний бал (1993)] [омонимия не снята] | T10: =INT(RAND()*50) -> 17 | U10: =IF(R[1]C[-13]=RC[-13],) -> 0 | V10: =INT(RAND()*25) -> 23
A11: акьсюЛ илежуеН я аламудоп | B11: алатупереп | C11: ― подумала я. ― Неужели Люська | D11: перепутала | E11: ?» | F11: Я еще раз попыталась его | G11: Вера Белоусова. По субботам не стреляю (2000) | H11: Вера Белоусова | I11: 1958 | J11: По субботам не стреляю | K11: 2000 | L11: художественная | M11: повесть | O11: Вера Белоусова. Второй выстрел | P11: 2000 | Q11: книга | R11: омонимия не снята | S11: ― подумала я. ― Неужели Люська перепутала?» Я еще раз попыталась его повернуть, потянула дверь на себя, потом, наоборот, слегка нажала, пытаясь найти правильное положение, и тут дверь открылась. [Вера Белоусова. По субботам не стреляю (2000)] [омонимия не снята] | T11: =INT(RAND()*50) -> 12 | U11: =IF(R[1]C[-13]=RC[-13],) -> 0 | V11: =INT(RAND()*25) -> 2
A12: акйалам и утнаб рген арап | B12: алатупереп | C12: пара ― негр банту и малайка ― | D12: перепутала | F12: полушария и явилась сюда покататься | G12: Аркадий Стругацкий, Борис Стругацкий. Жук в муравейнике (1979) | H12: Аркадий Стругацкий, Борис Стругацкий | I12: 1925, 1933 | J12: Жук в муравейнике | K12: 1979 | L12: художественная | M12: роман | P12: 2004 | Q12: книга | R12: омонимия не снята | S12: Эта пара ― негр банту и малайка ― перепутала полушария и явилась сюда покататься, видите ли, на лыжах. [Аркадий Стругацкий, Борис Стругацкий. Жук в муравейнике (1979)] [омонимия не снята] | T12: =INT(RAND()*50) -> 36 | U12: =IF(R[1]C[-13]=RC[-13],) -> 0 | V12: =INT(RAND()*25) -> 23
A13: тот отч авонакримеТ ьтаджебу лачан | B13: латупереп | C13: начал убеждать Темирканова, что тот | D13: перепутал | E13: ― | F13: он всегда желанный гость на | G13: Сати Спивакова. Не всё (2002) | H13: Сати Спивакова | I13: 1962 | J13: Не всё | K13: 2002 | L13: публицистика, нехудожественная | M13: мемуары | O13: Сати Спивакова. Не всё | P13: 2002 | Q13: книга | R13: омонимия снята | S13: Володя начал убеждать Темирканова, что тот перепутал― он всегда желанный гость на фестивале, но сам же и отказался от участия. [Сати Спивакова. Не всё (2002)] [омонимия снята] | T13: =INT(RAND()*50) -> 3 | U13: =IF(R[1]C[-13]=RC[-13],) -> 0 | V13: =INT(RAND()*25) -> 4
A14: заказ отч ыТ йокур оге | B14: алатупереп | C14: его рукой. ― Ты что… заказ | D14: перепутала | E14: ? | F14: ― Внушительно посмотрел мэтр на нее | G14: Сергей Осипов. Страсти по Фоме. Книга третья. Книга Перемен (1998) | H14: Сергей Осипов | J14: Страсти по Фоме. Книга третья. Книга Перемен | K14: 1998 | L14: художественная | M14: роман | O14: Сергей Осипов. Страсти по Фоме | P14: 2003 | Q14: книга | R14: омонимия не снята | S14: Нина, вытирая руки, от предчувствия, о фиговый листок передника, появилась под его рукой. ― Ты что… заказ перепутала? ― Внушительно посмотрел мэтр на нее. [Сергей Осипов. Страсти по Фоме. Книга третья. Книга Перемен (1998)] [омонимия не снята] | T14: =INT(RAND()*50) -> 30 | U14: =IF(R[1]C[-13]=RC[-13],) -> 0 | V14: =INT(RAND()*25) -> 1
A15: овтсьлетиварп отч ьтазакс ыб гом | B15: олатупереп | C15: мог бы сказать, что правительство | D15: перепутало | F15: порядок ходов. | G15: Борис Вишневский. Двухпроцентная реформа // «Московские новости», 2003 | H15: Борис Вишневский | I15: 1955 | J15: Двухпроцентная реформа | K15: 2003 | L15: публицистика , нехудожественная | M15: статья | N15: политика и общественная жизнь | O15: «Московские новости» | P15: 2003 | Q15: газета | R15: омонимия не снята | S15: Известный как один из самых сильных думских шахматистов, Жуков мог бы сказать, что правительство перепутало порядок ходов. [Борис Вишневский. Двухпроцентная реформа // «Московские новости», 2003] [омонимия не снята] | T15: =INT(RAND()*50) -> 35 | U15: =IF(R[1]C[-13]=RC[-13],) -> 0 | V15: =INT(RAND()*25) -> 16
A16: икитваномсок йоннемервос илетавонсо ыцто илежуеН | B16: илатупереп | C16: Неужели отцы ― основатели современной космонавтики | D16: перепутали | E16: : | F16: подарили нам не ключи от | G16: Александр Волков. Время вековых открытий еще впереди! // «Знание - сила», 2011 | H16: Александр Волков | J16: Время вековых открытий еще впереди! | K16: 2011 | L16: публицистика , нехудожественная | M16: статья | N16: история, техника, наука и технологии, астрономия | O16: «Знание - сила» | P16: 2011 | Q16: журнал | R16: омонимия не снята | S16: Неужели отцы ― основатели современной космонавтики перепутали: подарили нам не ключи от седьмого неба, а ключи от пресловутого ящика Пандоры? [Александр Волков. Время вековых открытий еще впереди! // «Знание - сила», 2011] [омонимия не снята] | T16: =INT(RAND()*50) -> 36 | U16: =IF(R[1]C[-13]=RC[-13],) -> 0 | V16: =INT(RAND()*25) -> 24
A17: ежкат а унидерес в литсемереп | B17: латупереп | C17: переместил в середину, а также | D17: перепутал | F17: последовательность всех остальных частей. | G17: Никита Богословский. Заметки на полях шляпы (1997) | H17: Никита Богословский | I17: 1913 | J17: Заметки на полях шляпы | K17: 1997 | L17: художественная | M17: миниатюра | O17: Никита Богословский. Заметки на полях шляпы | P17: 1997 | Q17: книга | R17: омонимия не снята | S17: 26 ноября на вечернем сеансе во время премьеры фильма «Академик Бурдасов» киномеханик г-н Разбитной, находясь в нетрезвом состоянии, при демонстрации картины дважды (в начале и в конце) показал последнюю часть, начальные титры переместил в середину, а также перепутал последовательность всех остальных частей. [Никита Богословский. Заметки на полях шляпы (1997)] [омонимия не снята] | T17: =INT(RAND()*50) -> 46 | U17: =IF(R[1]C[-13]=RC[-13],) -> 0 | V17: =INT(RAND()*25) -> 21
A18: кат еж каК ястюялвиду тюаха | B18: латупереП | C18: ахают, удивляются: ― Как же так… ― | D18: Перепутал | E18: … | F18: ― Забыл… Крепко нас избили. | G18: С. Л. Рябцева. Дети восьмидесятых (1989) | H18: С. Л. Рябцева | J18: Дети восьмидесятых | K18: 1989 | L18: публицистика, нехудожественная | M18: монография | N18: образование | O18: С. Л. Рябцева. Дети восьмидесятых | P18: 1989 | Q18: книга | R18: омонимия не снята | S18: Молча показываю нелепицу ― ахают, удивляются: ― Как же так… ― Перепутал… ― Забыл… Крепко нас избили. [С. Л. Рябцева. Дети восьмидесятых (1989)] [омонимия не снята] | T18: =INT(RAND()*50) -> 6 | U18: =IF(R[1]C[-13]=RC[-13],) -> 0 | V18: =INT(RAND()*25) -> 23
A19: есв акрЮ отч от ан | B19: латупереп | C19: на то, что Юрка все | D19: перепутал | E19: , ― | F19: наоборот по сравнению с Юркой | G19: Я. Е. Харон. Злые песни Гийома дю Вентре (1965) // Я. Харон. Злые песни Гийома дю Вентре. Прозаический комментарий к поэтической биографии, 1989 | H19: Я. Е. Харон | I19: 1914 | J19: Злые песни Гийома дю Вентре | K19: 1965 | L19: публицистика , нехудожественная | M19: мемуары | O19: Я. Харон. Злые песни Гийома дю Вентре. Прозаический комментарий к поэтической биографии | P19: 1989 | Q19: газета | R19: омонимия не снята | S19: Он стал сажать их, как ему представлялось, вверх тормашками, а я ― из тех же намерений, но только с поправкой на то, что Юрка все перепутал, ― наоборот по сравнению с Юркой. [Я. Е. Харон. Злые песни Гийома дю Вентре (1965) // Я. Харон. Злые песни Гийома дю Вентре. Прозаический комментарий к поэтической биографии, 1989] [омонимия не снята] | T19: =INT(RAND()*50) -> 9 | U19: =IF(R[1]C[-13]=RC[-13],) -> 0 | V19: =INT(RAND()*25) -> 12
A20: йуб еишведив ыбокя идюл отч | B20: илатупереп | C20: что люди, якобы видевшие буй, | D20: перепутали | F20: его с обыкновенной медузой, которые | G20: Владимир Саввин. Тайна зеленого буя (2002) // «Коммерсантъ-Власть», 2002.02.26 | H20: Владимир Саввин | J20: Тайна зеленого буя | K20: 2002 | L20: публицистика , нехудожественная | M20: статья | N20: армия и вооруженные конфликты | O20: «Коммерсантъ-Власть» | P20: 2002.02.26 | Q20: журнал | R20: омонимия не снята | S20: Многократные допросы свидетелей показали, что люди, якобы видевшие буй, перепутали его с обыкновенной медузой, которые летом нередко заходят в Баренцево море. [Владимир Саввин. Тайна зеленого буя (2002) // «Коммерсантъ-Власть», 2002.02.26] [омонимия не снята] | T20: =INT(RAND()*50) -> 16 | U20: =IF(R[1]C[-13]=RC[-13],) -> 0 | V20: =INT(RAND()*25) -> 22
A21: я евтснаитсирх о икчомиС харовогзар | B21: латупереп | C21: разговорах Симочки о христианстве я | D21: перепутал | F21: двух Марий: то, что там | G21: Зоя Масленикова. Разговоры с Пастернаком (2001) | H21: Зоя Масленикова | I21: 1923 | J21: Разговоры с Пастернаком | K21: 2001 | L21: публицистика , нехудожественная | M21: мемуары | O21: Зоя Масленикова. Борис Пастернак. Встречи | P21: 2002 | Q21: книга | R21: омонимия не снята | S21: Сначала он удостоверился, что дверь закрыта, а потом вполголоса сообщил, что в разговорах Симочки о христианстве я перепутал двух Марий: то, что там написано о Марии Магдалине, на самом деле относится к Марии Египетской. [Зоя Масленикова. Разговоры с Пастернаком (2001)] [омонимия не снята] | T21: =INT(RAND()*50) -> 35 | U21: =IF(R[1]C[-13]=RC[-13],) -> 0 | V21: =INT(RAND()*25) -> 20
A22: ен умет ыт | B22: латупереп | C22: [Женя, nick] ты тему не | D22: перепутал | E22: , | F22: ми говорим о СS. | G22: коллективный. Форум: Серверные шутеры. CS 1.6 (2008-2010) | H22: коллективный | J22: Форум: Серверные шутеры. CS 1.6 | K22: 2008-2010 | L22: электронная коммуникация , нехудожественная | M22: форум | N22: досуг, зрелища и развлечения | Q22: электронный текст | R22: омонимия не снята | S22: [Женя, nick] ты тему не перепутал, ми говорим о СS. [коллективный. Форум: Серверные шутеры. CS 1.6 (2008-2010)] [омонимия не снята] | T22: =INT(RAND()*50) -> 36 | U22: =IF(R[1]C[-13]=RC[-13],) -> 0 | V22: =INT(RAND()*25) -> 6
A23: молагуп с оге ыт отч | B23: алатупереп | C23: что ты его с пугалом | D23: перепутала | E23: . | G23: Дарья Донцова. Доллары царя Гороха (2004) | H23: Дарья Донцова | I23: 1952 | J23: Доллары царя Гороха | K23: 2004 | L23: художественная | M23: роман | O23: Дарья Донцова. Доллары царя Гороха | P23: 2004 | Q23: книга | R23: омонимия не снята | S23: ― То-то Дегтярев обрадуется, когда узнает, что ты его с пугалом перепутала. [Дарья Донцова. Доллары царя Гороха (2004)] [омонимия не снята] | T23: =INT(RAND()*50) -> 42 | U23: =IF(R[1]C[-13]=RC[-13],) -> 0 | V23: =INT(RAND()*25) -> 7
A24: ен мек с ин янем | B24: илатупереп | C24: меня ни с кем не | D24: перепутали | E24: ? | G24: Захар Прилепин. Санькя (2006) | H24: Захар Прилепин | I24: 1975 | J24: Санькя | K24: 2006 | L24: художественная | M24: роман | O24: Захар Прилепин. Санькя | P24: 2006 | Q24: книга | R24: омонимия не снята | S24: ― Вы меня ни с кем не перепутали? [Захар Прилепин. Санькя (2006)] [омонимия не снята] | T24: =INT(RAND()*50) -> 30 | U24: =IF(R[1]C[-13]=RC[-13],) -> 0 | V24: =INT(RAND()*25) -> 7
A25: ано иледиву имас и ым | B25: алатупереп | C25: мы и сами увидели, она | D25: перепутала | F25: все дела, с которыми сама | G25: Н. Н. Берберова. Железная женщина (1978-1980) | H25: Н. Н. Берберова | I25: 1901 | J25: Железная женщина | K25: 1978-1980 | L25: художественная | M25: роман | O25: Н. Берберова. Желещная женщина | P25: 1991 | Q25: книга | R25: омонимия не снята | S25: Это мы и сами увидели, она перепутала все дела, с которыми сама же к нам и обратилась. [Н. Н. Берберова. Железная женщина (1978-1980)] [омонимия не снята] | T25: =INT(RAND()*50) -> 47 | U25: =IF(R[1]C[-13]=RC[-13],) -> 0 | V25: =INT(RAND()*25) -> 4
A26: отч ясляоб нО | B26: театупереп | C26: Он боялся, что | D26: перепутает | F26: этот дом с другими, ведь | G26: Мария Рыбакова. Паннония // «Звезда», 2001 | H26: Мария Рыбакова | I26: 1973 | J26: Паннония | K26: 2001 | L26: художественная | M26: повесть | O26: «Звезда» | P26: 2001 | Q26: журнал | R26: омонимия не снята | S26: Он боялся, что перепутает этот дом с другими, ведь он уже убедился, что вовсе не узнавал родные места мгновенно, и даже спустя долгое время все еще сомневался, туда ли он попал. [Мария Рыбакова. Паннония // «Звезда», 2001] [омонимия не снята] | T26: =INT(RAND()*50) -> 46 | U26: =IF(R[1]C[-13]=RC[-13],) -> 0 | V26: =INT(RAND()*25) -> 19

Sheet: сводная с
A3: Количество из Author
A4: Названия строк | B4: Итог
B5: 1
A6: А. Т. Твардовский | B6: 1
A7: Александр Михайлов | B7: 1
A8: Александр Филюшкин | B8: 1
A9: Александра Маринина | B9: 1
A10: Анастас Микоян | B10: 1
A11: Андрей Белянин | B11: 1
A12: Андрей Измайлов | B12: 1
A13: Анна Ларина (Бухарина) | B13: 1
A14: Асар Эппель | B14: 1
A15: Борис Екимов | B15: 1
A16: В. А. Солоухин | B16: 1
A17: В. Д. Пришвина | B17: 1
A18: Василий Голованов | B18: 1
A19: Василий Гроссман | B19: 2
A20: Василий Катанян | B20: 1
A21: Вера Белоусова | B21: 1
A22: Виктор Конецкий | B22: 1
A23: Владимир Соловьев | B23: 1
A24: Г. Г. Демидов | B24: 1
A25: Г. Данилова | B25: 1
A26: Галина Шергова | B26: 1
A27: Д. Меркулов | B27: 1
A28: Д. С. Лихачев | B28: 1
A29: Дина Рубина | B29: 1
A30: Дина Сабитова | B30: 1
A31: Евгений Сухов | B31: 1
A32: Евгений Чижов | B32: 1
A33: Евгения Данилова | B33: 1
A34: Елена Топильская | B34: 1
A35: коллективный | B35: 1
A36: Лариса Васильева | B36: 1
A37: Леонид Юзефович | B37: 1
A38: М. Л. Гаспаров | B38: 1
A39: Марина Зосимкина | B39: 1
A40: Михаил Панин | B40: 1
A41: Михаил Чулаки | B41: 1
A42: Н. А. Оцуп | B42: 1
A43: Новелла Иванова | B43: 1
A44: Ольга Славникова | B44: 1
A45: Роман Солнцев | B45: 1
A46: Сергей Солоух | B46: 1
A47: Фазиль Искандер | B47: 3
A48: Ю. М. Нагибин | B48: 1
A49: Ю. П. Герман | B49: 1
A50: Юрий Азаров | B50: 1
A51: C. П. Мельгунов | B51: 1
A52: (пусто)
A53: Общий итог | B53: 50

Sheet: сводная пере
A3: Количество из Author
A4: Названия строк | B4: Итог
B5: 2
A6: Александр Волков | B6: 1
A7: Александра Маринина | B7: 1
A8: Анатолий Найман | B8: 1
A9: Анатолий Трушкин | B9: 1
A10: Андрей Волос | B10: 1
A11: Андрей Геласимов | B11: 1
A12: Анна Берсенева | B12: 1
A13: Аркадий Стругацкий, Борис Стругацкий | B13: 1
A14: Белла Езерская | B14: 1
A15: Борис Вишневский | B15: 1
A16: В. И. Аблазов | B16: 1
A17: Валентин Постников | B17: 1
A18: Василий Аксенов | B18: 2
A19: Василий Белов | B19: 1
A20: Василий Песков | B20: 1
A21: Вера Белоусова | B21: 2
A22: Владимир Абаринов | B22: 1
A23: Владимир Саввин | B23: 1
A24: Владлен Давыдов | B24: 1
A25: Г. Е. Николаева | B25: 1
A26: Дарья Донцова | B26: 1
A27: Дмитрий Емец | B27: 1
A28: Евгений Велтистов | B28: 1
A29: Елена Короп | B29: 1
A30: Захар Прилепин | B30: 1
A31: Зоя Кошелева | B31: 1
A32: Зоя Масленикова | B32: 1
A33: коллективный | B33: 1
A34: Леонид Сапожников | B34: 1
A35: М. С. Шагинян | B35: 1
A36: Максим Милованов | B36: 1
A37: Мария Рыбакова | B37: 1
A38: Маша Трауб | B38: 1
A39: Н. Н. Берберова | B39: 1
A40: Наталья Шмелькова | B40: 2
A41: Никита Богословский | B41: 1
A42: Николай Климонтович | B42: 1
A43: С. Л. Рябцева | B43: 1
A44: Сати Спивакова | B44: 1
A45: Сергей Осипов | B45: 2
A46: Сергей Юрский | B46: 1
A47: Эдвард Радзинский | B47: 1
A48: Юлий Даниэль | B48: 1
A49: Я. Е. Харон | B49: 1
A50: (пусто)
A51: Общий итог | B51: 50

Sheet: Лист8
A3: Количество из PARTICIPANT2 | B3: Названия столбцов
A4: Названия строк | B4: абстрактный объект | C4: конкретное лицо | D4: лицо | E4: неодушувлённый конкретный объект | F4: отсутствует | G4: Общий итог
A5: пере | B5: 8 | D5: 4 | E5: 8 | F5: 5 | G5: 25
A6: с | B6: 11 | C6: 4 | D6: 2 | E6: 5 | F6: 3 | G6: 25
A7: Общий итог | B7: 19 | C7: 4 | D7: 6 | E7: 13 | F7: 8 | G7: 50

Sheet: Лист10
A3: Количество из PARTICIPANT2 | B3: Названия столбцов
A4: Названия строк | B4: абстрактный объект | C4: конкретное лицо | D4: лицо | E4: неодушувлённый конкретный объект | F4: отсутствует | G4: (пусто) | H4: Общий итог
A5: пере | B5: 8 | D5: 4 | E5: 8 | F5: 5 | H5: 25
A6: с | B6: 11 | C6: 4 | D6: 2 | E6: 5 | F6: 3 | H6: 25
A7: (пусто)
A8: Общий итог | B8: 19 | C8: 4 | D8: 6 | E8: 13 | F8: 8 | H8: 50

Sheet: общее
A1: Reversed left context | B1: Reversed center | C1: Left context | D1: Center | E1: Punct | F1: Right context | G1: Title | H1: Author | I1: Birthday | J1: Header | K1: Created | L1: Sphere | M1: Type | N1: Topic | O1: Publication | P1: Publ_year | Q1: Medium | R1: Ambiguity | S1: Full context | T1: PREFIX | U1: TENSE | V1: PERSONNUMBER | W1: PARTICIPANT1 | X1: PARTICIPANT2 | Y1: PARTICIPANT3
A2: ен сав я мек с | B2: латупс | C2: с кем я вас не | D2: спутал | E2: , ― | F2: говорит. | G2: Михаил Панин. Камикадзе // «Звезда», 2002 | H2: Михаил Панин | J2: Камикадзе | K2: 2002 | L2: художественная | M2: роман | O2: «Звезда» | P2: 2002 | Q2: журнал | R2: омонимия не снята | S2: ― Ни с кем я вас не спутал, ― говорит. [Михаил Панин. Камикадзе // «Звезда», 2002] [омонимия не снята] | T2: с | U2: прошедшее | V2: 3 лицо ед.число | W2: лицо | X2: лицо | Y2: отсутствует
A3: ончоран возохлок едяр в тяровоГ | B3: илатупс | C3: Говорят, в ряде колхозов нарочно | D3: спутали | F3: хорошее зерно с отходами, чтобы | G3: Анастас Микоян. Так было (1971-1974) | H3: Анастас Микоян | I3: 1895 | J3: Так было | K3: 1971-1974 | L3: публицистика , нехудожественная | M3: мемуары | O3: Анастас Микоян. Так было | P3: 1999 | Q3: книга | R3: омонимия не снята | S3: Говорят, в ряде колхозов нарочно спутали хорошее зерно с отходами, чтобы после разговора о заготовках иметь это как ресурсы для маневрирования. [Анастас Микоян. Так было (1971-1974)] [омонимия не снята] | T3: с | U3: прошедшее | V3: 3 лицо мн.число | W3: неопределённое лицо | X3: неодушувлённый конкретный объект | Y3: неодушевлённый конкретный объект
A4: ен никшыМ йыроток солог йикснеж | B4: латупс | C4: женский голос, который Мышкин не | D4: спутал | F4: бы ни с каким другим | G4: Вера Белоусова. Жил на свете рыцарь бедный (2000) | H4: Вера Белоусова | I4: 1958 | J4: Жил на свете рыцарь бедный | K4: 2000 | L4: художественная | M4: роман | O4: Вера Белоусова. «Жил на свете рыцарь бедный» | P4: 2000 | Q4: книга | R4: омонимия не снята | S4: ― Я хотела бы поговорить с… господином Мышкиным, ― с легкой запинкой произнес женский голос, который Мышкин не спутал бы ни с каким другим. [Вера Белоусова. Жил на свете рыцарь бедный (2000)] [омонимия не снята] | T4: с | U4: прошедшее | V4: 3 лицо ед.число | W4: лицо | X4: абстрактный объект | Y4: абстрактный объект
A5: илсым укылатнап с либс имигортс | B5: латупс | C5: строгими сбил с панталыку, мысли | D5: спутал | E5: , | F5: суровым, грозным: | G5: Сергей Солоух. Клуб одиноких сердец унтера Пришибеева (1991-1995) | H5: Сергей Солоух | I5: 1959 | J5: Клуб одиноких сердец унтера Пришибеева | K5: 1991-1995 | L5: художественная | M5: роман | O5: Сергей Солоух. Клуб одиноких сердец унтера Пришибеева | P5: 2002 | Q5: книга | R5: омонимия не снята | S5: Хорошо, Шурка Лыткин, одноклассник, фэн, свидетель и участник «тех самых» развеселых танцев, студент-механик ныне, как раз в этот самый вечер дежурил в раздевалке, услышал шум, из амбразуры выскочил, оттер майора отставного, словами правильными, строгими сбил с панталыку, мысли спутал, суровым, грозным: [Сергей Солоух. Клуб одиноких сердец унтера Пришибеева (1991-1995)] [омонимия не снята] | T5: с | U5: прошедшее | V5: 3 лицо ед.число | W5: лицо | X5: абстрактный объект | Y5: отсутствует
A6: ен меч с ин йыроток | B6: ьшеатупс | C6: который ни с чем не | D6: спутаешь | E6: , | F6: единожды услышав, ― это был крик | G6: Василий Голованов. Остров, или оправдание бессмысленных путешествий (2002) | H6: Василий Голованов | I6: 1960 | J6: Остров, или оправдание бессмысленных путешествий | K6: 2002 | L6: публицистика , нехудожественная | M6: монография | N6: путешествия | O6: В. Голованов. Остров, или оправдание бессмысленных путешествий | P6: 2002 | Q6: книга | R6: омонимия не снята | S6: Я начал подниматься наверх, как вдруг услышал крик, который ни с чем не спутаешь, единожды услышав, ― это был крик сокола-сапсана! [Василий Голованов. Остров, или оправдание бессмысленных путешествий (2002)] [омонимия не снята] | T6: с | U6: будущее | V6: 2 лицо ед.число | W6: абстрактное лицо | X6: абстрактный объект | Y6: отсутствует
A7: ен огондо ин и огогурд | B7: ьшеатупс | C7: другого; и ни одного не | D7: спутаешь | F7: с другим. | G7: М. Л. Гаспаров. Занимательная Греция (1998) | H7: М. Л. Гаспаров | I7: 1935 | J7: Занимательная Греция | K7: 1998 | L7: учебно-научная , нехудожественная | M7: монография | N7: наука и технологии, история, искусство и культура | O7: М. Л. Гаспаров. Занимательная Греция | P7: 1998 | Q7: книга | R7: омонимия не снята | S7: Пять поэтов, пять отрывков, один короче другого; и ни одного не спутаешь с другим. [М. Л. Гаспаров. Занимательная Греция (1998)] [омонимия не снята] | T7: с | U7: будущее | V7: 2 лицо ед.число | W7: абстрактное лицо | X7: абстрактный объект | Y7: абстрактный объект
A8: я ен отЭ | B8: алатупс | C8: ― Это не я | D8: спутала | E8: , | F8: это он перепутал. | G8: Анна Ларина (Бухарина). Незабываемое (1986-1990) | H8: Анна Ларина (Бухарина) | I8: 1914 | J8: Незабываемое | K8: 1986-1990 | L8: публицистика , нехудожественная | M8: мемуары | O8: Анна Ларина-Бухарина. Незабываемое | P8: 2002 | Q8: книга | R8: омонимия не снята | S8: ― Это не я спутала, это он перепутал. [Анна Ларина (Бухарина). Незабываемое (1986-1990)] [омонимия не снята] | T8: с | U8: прошедшее | V8: 3 лицо ед.число | W8: лицо | X8: отсутствует | Y8: отсутствует
A9: умомидив-оп мотэ ирП | B9: илатупс | C9: При этом, по-видимому, | D9: спутали | F9: русское зарубежье с зарубежьем вообще | G9: Ольга Славникова. Ландшафты хеппи-энда // «Октябрь», 2001 | H9: Ольга Славникова | I9: 1957 | J9: Ландшафты хеппи-энда | K9: 2001 | L9: публицистика , нехудожественная | M9: статья | N9: искусство и культура | O9: «Октябрь» | P9: 2001 | Q9: журнал | R9: омонимия не снята | S9: При этом, по-видимому, спутали русское зарубежье с зарубежьем вообще, а «возвращенную» литературу с тем, что реально овладевает умами по ту сторону рухнувшего железного занавеса. [Ольга Славникова. Ландшафты хеппи-энда // «Октябрь», 2001] [омонимия не снята] | T9: с | U9: прошедшее | V9: 3 лицо мн.число | W9: неопределённое лицо | X9: абстрактный объект | Y9: абстрактный объект
A10: но ацмен укур отч модяр | B10: латупс | C10: рядом, что руку немца он | D10: спутал | F10: с поляковской рукой. | G10: Василий Гроссман. Жизнь и судьба, часть 2 (1960) | H10: Василий Гроссман | I10: 1905 | J10: Жизнь и судьба, часть 2 | K10: 1960 | L10: художественная | M10: роман | O10: Гроссман В. Жизнь и судьба | P10: 1992 | Q10: книга | R10: омонимия снята | S10: Но сейчас он растерялся, его поразило, что, оглушённый и ослеплённый, он утешался, чувствуя немца рядом, что руку немца он спутал с поляковской рукой. [Василий Гроссман. Жизнь и судьба, часть 2 (1960)] [омонимия снята] | T10: с | U10: прошедшее | V10: 3 лицо ед.число | W10: лицо | X10: конкретное лицо | Y10: конкретное лицо
A11: тежоМ аледис апарт у монофоскас | B11: илатупс | C11: саксофоном у трапа сидела. ― Может, | D11: спутали | E11: ? | F11: У нее корнет-а-пистон. | G11: Виктор Конецкий. Вчерашние заботы (1979) | H11: Виктор Конецкий | I11: 1929 | J11: Вчерашние заботы | K11: 1979 | L11: художественная | M11: повесть | O11: Конецкий В. Начало конца комедии | P11: 1990 | Q11: книга | R11: омонимия не снята | S11: ― А я на судно приехал, она с саксофоном у трапа сидела. ― Может, спутали? У нее корнет-а-пистон. [Виктор Конецкий. Вчерашние заботы (1979)] [омонимия не снята] | T11: с | U11: прошедшее | V11: 3 лицо мн.число | W11: неопределённое лицо | X11: отсутствует | Y11: отсутствует
A12: ен ыб монацап с откин | B12: латупс | C12: никто с пацаном бы не | D12: спутал | E12: . | G12: Марина Зосимкина. Ты проснешься. Книга первая (2015) | H12: Марина Зосимкина | J12: Ты проснешься. Книга первая | K12: 2015 | L12: художественная | M12: роман | O12: М. Зосимкина. Ты проснешься. Монреаль: Accent Graphics Communications | P12: 2015 | Q12: книга | R12: омонимия не снята | S12: Естественно, Катя была тут не единственная девушка-стрелок, но, к примеру, у Олеси этих проблем не было, поскольку Олеся имела такие ярко выраженные формы ― что сзади, что сбоку, что спереди, ― что даже в одеянии буддийского монаха ее никто с пацаном бы не спутал. [Марина Зосимкина. Ты проснешься. Книга первая (2015)] [омонимия не снята] | T12: с | U12: прошедшее | V12: 3 лицо ед.число | W12: абстрактное лицо | X12: конкретное лицо | Y12: абстрактное лицо
A13: ен я жу от ьрепет | B13: юатупс | C13: теперь-то уж я не | D13: спутаю | F13: ее ни с чем! | G13: В. Д. Пришвина. Невидимый град (1962) | H13: В. Д. Пришвина | I13: 1899 | J13: Невидимый град | K13: 1962 | L13: художественная проза | M13: роман | O13: Пришвина В. Д. Невидимый град. М.: Молодая гвардия, 2003 | P13: 2003 | Q13: книга | R13: омонимия не снята | S13: Правда, Михаил Сергеевич мой «благодетель», но любви к нему, как бы я того ни желала, ничто не может во мне пробудить: теперь-то уж я не спутаю ее ни с чем! [В. Д. Пришвина. Невидимый град (1962)] [омонимия не снята] | T13: с | U13: будущее | V13: 1 лицо ед.число | W13: лицо | X13: абстрактный объект | Y13: отсутствует
A14: ен ьдеВ | B14: ьшеатупс | C14: Ведь не | D14: спутаешь | F14: между собой даже звучащие на | G14: Д. Меркулов. Концертный зал в квартире // «Наука и жизнь», 2006 | H14: Д. Меркулов | J14: Концертный зал в квартире | K14: 2006 | L14: производственно-техническая , нехудожественная | M14: статья | N14: техника | O14: «Наука и жизнь» | P14: 2006 | Q14: журнал | R14: омонимия не снята | S14: Ведь не спутаешь между собой даже звучащие на одной ноте, скажем, скрипку и гобой или гитару и фортепьяно. [Д. Меркулов. Концертный зал в квартире // «Наука и жизнь», 2006] [омонимия не снята] | T14: с | U14: будущее | V14: 2 лицо ед.число | W14: абстрактное лицо | X14: абстрактный объект | Y14: абстрактный объект
A15: ен оге отч каТ | B15: ьшеатупс | C15: Так что его не | D15: спутаешь | F15: ни с кем. | G15: Евгений Сухов. Делу конец -- сроку начало (2007) | H15: Евгений Сухов | I15: 1959 | J15: Делу конец -- сроку начало | K15: 2007 | L15: художественная | M15: роман | O15: Е. Е. Сухов. Делу конец -- сроку начало | P15: 2007 | Q15: книга | R15: омонимия не снята | S15: Так что его не спутаешь ни с кем. [Евгений Сухов. Делу конец -- сроку начало (2007)] [омонимия не снята] | T15: с | U15: будущее | V15: 2 лицо ед.число | W15: абстрактное лицо | X15: лицо | Y15: отсутствует
A16: кичтадереп телиб йовс ан тевто | B16: латупс | C16: ответ на свой билет, передатчик | D16: спутал | F16: канал и в двоичном коде | G16: Параллель // «Студенческий меридиан», 1985 | J16: Параллель | K16: 1985 | L16: художественная | M16: миниатюра | O16: «Студенческий меридиан» | P16: 1985 | Q16: журнал | R16: омонимия не снята | S16: ― Когда я настроился, чтобы получить ответ на свой билет, передатчик спутал канал и в двоичном коде стал выдавать мне положительные черты Наташи Ростовой и отрицательные ― Ноздрева, а затем и вовсе замолчал. [Параллель // «Студенческий меридиан», 1985] [омонимия не снята] | T16: с | U16: прошедшее | V16: 3 лицо ед.число | W16: лицо | X16: неодушувлённый конкретный объект | Y16: отсутствует
A17: ыб окьлот ен но утуним | B17: латупс | C17: минуту он не только бы | D17: спутал | F17: ароматические букеты одного, другого… пятого | G17: Андрей Измайлов. Трюкач (2001) | H17: Андрей Измайлов | I17: 1953 | J17: Трюкач | K17: 2001 | L17: художественная | M17: роман | O17: Андрей Измайлов. Трюкач | P17: 2001 | Q17: книга | R17: омонимия не снята | S17: Но в сию минуту он не только бы спутал ароматические букеты одного, другого… пятого, он, хлебни глоток, не отличил бы вкус и запах от скипидара-ацетона. [Андрей Измайлов. Трюкач (2001)] [омонимия не снята] | T17: с | U17: прошедшее | V17: 3 лицо ед.число | W17: лицо | X17: неодушувлённый конкретный объект | Y17: отсутствует
A18: ен овтсещус еокакин йыроток йызугрук | B18: олатупс | C18: кургузый, который никакое существо не | D18: спутало | F18: бы с настоящим куриным яйцом | G18: В. А. Солоухин. Смех за левым плечом (1989) | H18: В. А. Солоухин | I18: 1924 | J18: Смех за левым плечом | K18: 1989 | L18: художественная | M18: повесть | O18: Солоухин В. А. Смех за левым плечом: Книга прозы | P18: 1989 | Q18: книга | R18: омонимия не снята | S18: В ямке подкладыш ― яйцо, сшитое из белой тряпочки, продолговатый мячик, набитый ватой, угловатый, кургузый, который никакое существо не спутало бы с настоящим куриным яйцом, кроме самой курицы, впрочем, может быть, более снисходительной, нежели неразборчивой и глупой. [В. А. Солоухин. Смех за левым плечом (1989)] [омонимия не снята] | T18: с | U18: прошедшее | V18: 3 лицо ед.число | W18: абстрактное лицо | X18: неодушувлённый конкретный объект | Y18: неодушевлённый конкретный объект
A19: мокриц с ен мосач ее | B19: латупс | C19: ее часом не с цирком | D19: спутал | E19: ? | G19: Г. Г. Демидов. Оборванный дуэт (1973) | H19: Г. Г. Демидов | I19: 1908 | J19: Оборванный дуэт | K19: 1973 | L19: художественная | M19: рассказ | Q19: книга | R19: омонимия не снята | S19: ― Над щипачем, с воровскими целями посещавшим оперу, иронизировали: ― Ты ее часом не с цирком спутал? [Г. Г. Демидов. Оборванный дуэт (1973)] [омонимия не снята] | T19: с | U19: прошедшее | V19: 3 лицо ед.число | W19: лицо | X19: неодушувлённый конкретный объект | Y19: неодушевлённый конкретный объект
A20: язянк огокилев оготэ либу йевоныс | B20: илатупс | C20: сыновей убил этого великого князя) | D20: спутали | F20: всё. | G20: Лариса Васильева. Озарённая // «Наука и религия», 2011 | H20: Лариса Васильева | J20: Озарённая | K20: 2011 | L20: художественная | M20: повесть | O20: «Наука и религия» | P20: 2011 | Q20: журнал | R20: омонимия не снята | S20: Едва успел встать на праведный путь князь Владимир Красное Солнышко, едва осенил он крестом Днепр, его берега, народ окрестный и себя, как злоба, зависть, алчность потомков (по слухам, один из сыновей убил этого великого князя) спутали всё. [Лариса Васильева. Озарённая // «Наука и религия», 2011] [омонимия не снята] | T20: с | U20: прошедшее | V20: 3 лицо мн.число | W20: абстарктные объекты | X20: отсутствует | Y20: отсутствует
A21: ен миьч с ин солог | B21: ьшеатупс | C21: голос ни с чьим не | D21: спутаешь | E21: . | G21: Михаил Чулаки. Примус // «Звезда», 2002 | H21: Михаил Чулаки | I21: 1941 | J21: Примус | K21: 2002 | L21: художественная | M21: роман | O21: «Звезда» | P21: 2002 | Q21: журнал | R21: омонимия не снята | S21: Как будто он и сам не узнал бы Шурку ― его голос ни с чьим не спутаешь. [Михаил Чулаки. Примус // «Звезда», 2002] [омонимия не снята] | T21: с | U21: прошедшее | V21: 2 лицо ед.число | W21: абстрактное лицо | X21: абстрактный объект | Y21: отсутствует
A22: ииссоР в яицюловеР онечноказ олыб | B22: алатупс | C22: было закончено. Революция в России | D22: спутала | F22: все карты. В феврале 1917 | G22: Александр Филюшкин. Рус, не спи в гробу! // «Родина», 2000 | H22: Александр Филюшкин | J22: Рус, не спи в гробу! | K22: 2000 | L22: публицистика, нехудожественная | M22: статья | N22: история, политика и общественная жизнь | O22: «Родина» | P22: 2000 | Q22: журнал | R22: омонимия не снята | S22: Противостояние германских разведок и русской контрразведки в годы Первой мировой не было закончено. Революция в России спутала все карты. В феврале 1917 года из Петроградской тюрьмы было выпущено, несмотря на все протесты контрразведки, 97 человек, арестованных по обвинению в сотрудничестве с врагом. [Александр Филюшкин. Рус, не спи в гробу! // «Родина», 2000] [омонимия не снята] | T22: с | U22: прошедшее | V22: 3 лицо ед.число | W22: абстрактное лицо | X22: абстрактный объект | Y22: отсутствует
A23: и илашемс есв икинтупС | B23: илатупс | C23: Спутники все смешали и | D23: спутали | E23: , | F23: все как-то вдруг устарело и | G23: А. Т. Твардовский. Из рабочих тетрадей (1957) // «Знамя», 1989 | H23: А. Т. Твардовский | I23: 1910 | J23: Из рабочих тетрадей | K23: 1957 | L23: бытовая, нехудожественная | M23: дневник, записные книжки | N23: частная жизнь | O23: «Знамя» | P23: 1989 | Q23: журнал | R23: омонимия не снята | S23: Спутники все смешали и спутали, все как-то вдруг устарело и стало меньше ― особенно стихи. [А. Т. Твардовский. Из рабочих тетрадей (1957) // «Знамя», 1989] [омонимия не снята] | T23: с | U23: прошедшее | V23: 3 лицо мн.число | W23: лицо | X23: абстрактный объект | Y23: отсутствует
A24: ен огечин откин ыботч мокдяроп | B24: латупс | C24: порядком, чтобы никто ничего не | D24: спутал | E24: . | G24: Ю. П. Герман. Россия молодая. Часть первая (1952) | H24: Ю. П. Герман | I24: 1910 | J24: Россия молодая. Часть первая | K24: 1952 | L24: художественная | M24: роман | O24: Ю. Герман. Россия молодая. Книга 1 | P24: 1954 | Q24: книга | R24: омонимия не снята | S24: Полковник Снивин молчал, похлопывая коня рукой в перчатке с раструбом, смотрел за порядком, чтобы никто ничего не спутал. [Ю. П. Герман. Россия молодая. Часть первая (1952)] [омонимия не снята] | T24: с | U24: прошедшее | V24: 3 лицо ед.число | W24: неопределённое лицо | X24: абстрактный объект | Y24: отсутствует
A25: азок укверев яавичароку мозар мыджак | B25: театупс | C25: каждым разом укорачивая веревку, коза | D25: спутает | F25: себе в конце концов все | G25: Асар Эппель. Леонидова победа (1990-2000) | H25: Асар Эппель | I25: 1935 | J25: Леонидова победа | K25: 1990-2000 | L25: художественная | M25: рассказ | O25: Асар Эппель. Шампиньон моей жизни | P25: 2000 | Q25: книга | R25: омонимия не снята | S25: И если проделать все как надо, то, с каждым разом укорачивая веревку, коза спутает себе в конце концов все четыре ноги и неподвижно встанет или повалится, но истошно примется блеять, а ты уходишь куда шел, и выходит в очках Юливанна распутывать козьи ножки, а тут как раз, дымя козьей ножкой, идет Порфирий Петрович Государев и говорит: «Разводила бы ты, соседка, как вот я,живую белую мышь для одного институту, и коза ― ну ее в жердь, и жалованье дают, и крупа тебе остается!» [Асар Эппель. Леонидова победа (1990-2000)] [омонимия не снята] | T25: с | U25: будущее | V25: 3 лицо ед.число | W25: лицо | X25: конкретное лицо | Y25: отсутствует
A26: уме авонс хутсаП | B26: латупс | C26: Пастух снова ему | D26: спутал | F26: ноги, но он уже не | G26: Фазиль Искандер. Сандро из Чегема (Книга 3) (1989) | H26: Фазиль Искандер | I26: 1929 | J26: Сандро из Чегема (Книга 3) | K26: 1989 | L26: художественная | M26: роман | O26: Ф. А. Искандер. «Сандро из Чегема». Кн. 3 | P26: 1989 | Q26: книга | R26: омонимия не снята | S26: Пастух снова ему спутал ноги, но он уже не собирался выпрыгивать из машины. [Фазиль Искандер. Сандро из Чегема (Книга 3) (1989)] [омонимия не снята] | T26: с | U26: будущее | V26: 3 лицо ед.число | W26: лицо | X26: конкретное лицо | Y26: отсутствует
A27: мыротв ос оге акшувеД аляноп | B27: алатупереп | C27: поняла. Девушка его со вторым | D27: перепутала | E27: . | F27: Это во втором пробники Туморроу | G27: Красота, здоровье, отдых: Косметика и парфюм (форум) (2004) | J27: Красота, здоровье, отдых: Косметика и парфюм (форум) | K27: 2004 | L27: электронная коммуникация , нехудожественная | M27: форум | N27: частная жизнь | O27: Форум на eva.ru | P27: 2005 | Q27: электронный текст | R27: омонимия не снята | S27: А, я поняла. Девушка его со вторым перепутала. Это во втором пробники Туморроу давать будут. [Красота, здоровье, отдых: Косметика и парфюм (форум) (2004)] [омонимия не снята] | T27: пере | U27: прошедшее | V27: 3 лицо ед.число | W27: лицо | X27: абстрактный объект | Y27: абстрактный объект
A28: етещи огок ыВ | B28: илатупереП | C28: Вы кого ищете? | D28: Перепутали | E28: ? | F28: Если вы к Ибрагиму, так | G28: Андрей Волос. Дом у реки // «Новый Мир», 1998 | H28: Андрей Волос | I28: 1955 | J28: Дом у реки | K28: 1998 | L28: художественная | M28: повесть | O28: «Новый Мир» | P28: 1998 | Q28: журнал | R28: омонимия не снята | S28: Вы кого ищете? Перепутали? Если вы к Ибрагиму, так он в город уехал. [Андрей Волос. Дом у реки // «Новый Мир», 1998] [омонимия не снята] | T28: пере | U28: прошедшее | V28: 3 лицо мн.число | W28: неопределённое лицо | X28: отсутствует | Y28: отсутствует
A29: икинбечУ анелЕ пороК | B29: илатупереп | C29: Короп Елена. Учебники | D29: перепутали | F29: с агитками. Премьер-министром назначен Сергей | G29: Елена Короп. Учебники перепутали с агитками. Премьер-министром назначен Сергей Кириенко (2001) // «Известия», 2001.08.29 | H29: Елена Короп | J29: Учебники перепутали с агитками. Премьер-министром назначен Сергей Кириенко | K29: 2001 | L29: публицистика , нехудожественная | M29: статья | N29: наука и технологии | O29: «Известия» | P29: 2001.08.29 | Q29: газета | R29: омонимия не снята | S29: Короп Елена. Учебники перепутали с агитками. Премьер-министром назначен Сергей Кириенко [Елена Короп. Учебники перепутали с агитками. Премьер-министром назначен Сергей Кириенко (2001) // «Известия», 2001.08.29] [омонимия не снята] | T29: пере | U29: прошедшее | V29: 3 лицо мн.число | W29: неопределённое лицо | X29: неодушувлённый конкретный объект | Y29: неодушевлённый конкретный объект
A30: отсорп ано обил вокаруД булК | B30: алатупереп | C30: Клуб Дураков; либо она просто | D30: перепутала | F30: Тредьяковского и Коллинза (или меня | G30: Юлий Даниэль. Письма из заключения (1966-1970) | H30: Юлий Даниэль | I30: 1925 | J30: Письма из заключения | K30: 1966-1970 | L30: бытовая , нехудожественная | M30: письмо личное | N30: частная жизнь | O30: Юлий Даниэль. «Я всё сбиваюсь на литературу…» Письма из заключения. Стихи | P30: 2000 | Q30: книга | R30: омонимия не снята | S30: Возникло два предположения: либо это ― вступительный членский взнос от Наташки в Клуб Дураков; либо она просто перепутала Тредьяковского и Коллинза (или меня и Футмана? [Юлий Даниэль. Письма из заключения (1966-1970)] [омонимия не снята] | T30: пере | U30: прошедшее | V30: 3 лицо ед.число | W30: лицо | X30: лицо | Y30: лицо
A31: иревд ым тежоМ илшов утанмок | B31: илатупереп | C31: комнату вошли? Может, мы двери | D31: перепутали | E31: ? | F31: ― Нет, я точно помню: это | G31: Валентин Постников. Карандаш и Самоделкин в стране фараонов (1997) | H31: Валентин Постников | I31: 1970 | J31: Карандаш и Самоделкин в стране фараонов | K31: 1997 | L31: художественная | M31: сказка | O31: Валентин Постников. Карандаш и Самоделкин в стране фараонов | P31: 1997 | Q31: книга | R31: омонимия не снята | S31: ― Сам не пойму, ― может быть, мы не в ту комнату вошли? Может, мы двери перепутали? ― Нет, я точно помню: это та самая комната-ловушка, ― ответил уверенным тоном Дырка. [Валентин Постников. Карандаш и Самоделкин в стране фараонов (1997)] [омонимия не снята] | T31: пере | U31: прошедшее | V31: 3 лицо мн.число | W31: лицо | X31: неодушувлённый конкретный объект | Y31: неодушевлённый конкретный объект
A32: ынатш ад ьсилым ьтадив иовс | B32: илатупереп | C32: свои, ― видать, мылись да штаны | D32: перепутали | E32: . | G32: Василий Белов. Привычное дело (1967) | H32: Василий Белов | I32: 1932 | J32: Привычное дело | K32: 1967 | L32: художественная | M32: повесть | O32: Василий Белов. Сельские повести | P32: 1971 | Q32: книга | R32: омонимия не снята | S32: Гляжу, штаны-то у меня не свои, ― видать, мылись да штаны перепутали. [Василий Белов. Привычное дело (1967)] [омонимия не снята] | T32: пере | U32: прошедшее | V32: 3 лицо мн.число | W32: неопределённое лицо | X32: неодушувлённый конкретный объект | Y32: отсутствует
A33: мывокивоН мигурд от-микак с оге | B33: латупереп | C33: его с каким-то другим Новиковым | D33: перепутал | E33: ― | F33: из писателей, возможно… | G33: Анатолий Найман. Все и каждый // «Октябрь», 2003 | H33: Анатолий Найман | I33: 1936 | J33: Все и каждый | K33: 2003 | L33: художественная | M33: роман | O33: «Октябрь» | P33: 2003 | Q33: журнал | R33: омонимия не снята | S33: Возможно, я его с каким-то другим Новиковым перепутал ― из писателей, возможно… [Анатолий Найман. Все и каждый // «Октябрь», 2003] [омонимия не снята] | T33: пере | U33: прошедшее | V33: 3 лицо ед.число | W33: лицо | X33: лицо | Y33: лицо
A34: ыритравк я а атыркто алыб | B34: латупереп | C34: была открыта, а я квартиры | D34: перепутал | E34: , | F34: ваша восьмая, а мне нужна | G34: Анатолий Трушкин. 208 избранных страниц (1990-2002) | H34: Анатолий Трушкин | I34: 1941 | J34: 208 избранных страниц | K34: 1990-2002 | L34: художественная | M34: миниатюра | O34: Анатолий Трушкин. 208 избранных страниц | P34: 1999 | Q34: книга | R34: омонимия не снята | S34: Извините, у вас дверь была открыта, а я квартиры перепутал, ваша восьмая, а мне нужна четыреста сорок четвертая. [Анатолий Трушкин. 208 избранных страниц (1990-2002)] [омонимия не снята] | T34: пере | U34: прошедшее | V34: 3 лицо ед.число | W34: лицо | X34: неодушувлённый конкретный объект | Y34: неодушевлённый конкретный объект
A35: яславрос от-едг от-отК | B35: латупереп | C35: Кто-то где-то сорвался, | D35: перепутал | E35: , | F35: не туда положил. | G35: Сергей Юрский. Осенний бал (1993) | H35: Сергей Юрский | I35: 1935 | J35: Осенний бал | K35: 1993 | L35: художественная | M35: письмо литературное | O35: Юрский С. Содержимое ящика | P35: 1998 | Q35: книга | R35: омонимия не снята | S35: Кто-то где-то сорвался, перепутал, не туда положил. [Сергей Юрский. Осенний бал (1993)] [омонимия не снята] | T35: пере | U35: прошедшее | V35: 3 лицо ед.число | W35: неопределённое лицо | X35: отсутствует | Y35: отсутствует
A36: акьсюЛ илежуеН я аламудоп | B36: алатупереп | C36: ― подумала я. ― Неужели Люська | D36: перепутала | E36: ?» | F36: Я еще раз попыталась его | G36: Вера Белоусова. По субботам не стреляю (2000) | H36: Вера Белоусова | I36: 1958 | J36: По субботам не стреляю | K36: 2000 | L36: художественная | M36: повесть | O36: Вера Белоусова. Второй выстрел | P36: 2000 | Q36: книга | R36: омонимия не снята | S36: ― подумала я. ― Неужели Люська перепутала?» Я еще раз попыталась его повернуть, потянула дверь на себя, потом, наоборот, слегка нажала, пытаясь найти правильное положение, и тут дверь открылась. [Вера Белоусова. По субботам не стреляю (2000)] [омонимия не снята] | T36: пере | U36: прошедшее | V36: 3 лицо ед.число | W36: лицо | X36: отсутствует | Y36: отсутствует
A37: акйалам и утнаб рген арап | B37: алатупереп | C37: пара ― негр банту и малайка ― | D37: перепутала | F37: полушария и явилась сюда покататься | G37: Аркадий Стругацкий, Борис Стругацкий. Жук в муравейнике (1979) | H37: Аркадий Стругацкий, Борис Стругацкий | I37: 1925, 1933 | J37: Жук в муравейнике | K37: 1979 | L37: художественная | M37: роман | P37: 2004 | Q37: книга | R37: омонимия не снята | S37: Эта пара ― негр банту и малайка ― перепутала полушария и явилась сюда покататься, видите ли, на лыжах. [Аркадий Стругацкий, Борис Стругацкий. Жук в муравейнике (1979)] [омонимия не снята] | T37: пере | U37: прошедшее | V37: 3 лицо ед.число | W37: лицо | X37: неодушувлённый конкретный объект | Y37: неодушевлённый конкретный объект
A38: тот отч авонакримеТ ьтаджебу лачан | B38: латупереп | C38: начал убеждать Темирканова, что тот | D38: перепутал | E38: ― | F38: он всегда желанный гость на | G38: Сати Спивакова. Не всё (2002) | H38: Сати Спивакова | I38: 1962 | J38: Не всё | K38: 2002 | L38: публицистика, нехудожественная | M38: мемуары | O38: Сати Спивакова. Не всё | P38: 2002 | Q38: книга | R38: омонимия снята | S38: Володя начал убеждать Темирканова, что тот перепутал― он всегда желанный гость на фестивале, но сам же и отказался от участия. [Сати Спивакова. Не всё (2002)] [омонимия снята] | T38: пере | U38: прошедшее | V38: 3 лицо ед.число | W38: лицо | X38: отсутствует | Y38: отсутствует
A39: заказ отч ыТ йокур оге | B39: алатупереп | C39: его рукой. ― Ты что… заказ | D39: перепутала | E39: ? | F39: ― Внушительно посмотрел мэтр на нее | G39: Сергей Осипов. Страсти по Фоме. Книга третья. Книга Перемен (1998) | H39: Сергей Осипов | J39: Страсти по Фоме. Книга третья. Книга Перемен | K39: 1998 | L39: художественная | M39: роман | O39: Сергей Осипов. Страсти по Фоме | P39: 2003 | Q39: книга | R39: омонимия не снята | S39: Нина, вытирая руки, от предчувствия, о фиговый листок передника, появилась под его рукой. ― Ты что… заказ перепутала? ― Внушительно посмотрел мэтр на нее. [Сергей Осипов. Страсти по Фоме. Книга третья. Книга Перемен (1998)] [омонимия не снята] | T39: пере | U39: прошедшее | V39: 3 лицо ед.число | W39: лицо | X39: неодушувлённый конкретный объект | Y39: отсутствует
A40: овтсьлетиварп отч ьтазакс ыб гом | B40: олатупереп | C40: мог бы сказать, что правительство | D40: перепутало | F40: порядок ходов. | G40: Борис Вишневский. Двухпроцентная реформа // «Московские новости», 2003 | H40: Борис Вишневский | I40: 1955 | J40: Двухпроцентная реформа | K40: 2003 | L40: публицистика , нехудожественная | M40: статья | N40: политика и общественная жизнь | O40: «Московские новости» | P40: 2003 | Q40: газета | R40: омонимия не снята | S40: Известный как один из самых сильных думских шахматистов, Жуков мог бы сказать, что правительство перепутало порядок ходов. [Борис Вишневский. Двухпроцентная реформа // «Московские новости», 2003] [омонимия не снята] | T40: пере | U40: прошедшее | V40: 3 лицо ед.число | W40: лицо | X40: абстрактный объект | Y40: отсутствует
A41: икитваномсок йоннемервос илетавонсо ыцто илежуеН | B41: илатупереп | C41: Неужели отцы ― основатели современной космонавтики | D41: перепутали | E41: : | F41: подарили нам не ключи от | G41: Александр Волков. Время вековых открытий еще впереди! // «Знание - сила», 2011 | H41: Александр Волков | J41: Время вековых открытий еще впереди! | K41: 2011 | L41: публицистика , нехудожественная | M41: статья | N41: история, техника, наука и технологии, астрономия | O41: «Знание - сила» | P41: 2011 | Q41: журнал | R41: омонимия не снята | S41: Неужели отцы ― основатели современной космонавтики перепутали: подарили нам не ключи от седьмого неба, а ключи от пресловутого ящика Пандоры? [Александр Волков. Время вековых открытий еще впереди! // «Знание - сила», 2011] [омонимия не снята] | T41: пере | U41: прошедшее | V41: 3 лицо мн.число | W41: лицо | X41: абстрактный объект | Y41: абстрактный объект
A42: ежкат а унидерес в литсемереп | B42: латупереп | C42: переместил в середину, а также | D42: перепутал | F42: последовательность всех остальных частей. | G42: Никита Богословский. Заметки на полях шляпы (1997) | H42: Никита Богословский | I42: 1913 | J42: Заметки на полях шляпы | K42: 1997 | L42: художественная | M42: миниатюра | O42: Никита Богословский. Заметки на полях шляпы | P42: 1997 | Q42: книга | R42: омонимия не снята | S42: 26 ноября на вечернем сеансе во время премьеры фильма «Академик Бурдасов» киномеханик г-н Разбитной, находясь в нетрезвом состоянии, при демонстрации картины дважды (в начале и в конце) показал последнюю часть, начальные титры переместил в середину, а также перепутал последовательность всех остальных частей. [Никита Богословский. Заметки на полях шляпы (1997)] [омонимия не снята] | T42: пере | U42: прошедшее | V42: 3 лицо ед.число | W42: лицо | X42: абстрактный объект | Y42: отсутствует
A43: кат еж каК ястюялвиду тюаха | B43: латупереП | C43: ахают, удивляются: ― Как же так… ― | D43: Перепутал | E43: … | F43: ― Забыл… Крепко нас избили. | G43: С. Л. Рябцева. Дети восьмидесятых (1989) | H43: С. Л. Рябцева | J43: Дети восьмидесятых | K43: 1989 | L43: публицистика, нехудожественная | M43: монография | N43: образование | O43: С. Л. Рябцева. Дети восьмидесятых | P43: 1989 | Q43: книга | R43: омонимия не снята | S43: Молча показываю нелепицу ― ахают, удивляются: ― Как же так… ― Перепутал… ― Забыл… Крепко нас избили. [С. Л. Рябцева. Дети восьмидесятых (1989)] [омонимия не снята] | T43: пере | U43: прошедшее | V43: 3 лицо ед.число | W43: неопределённое лицо | X43: отсутствует | Y43: отсутствует
A44: есв акрЮ отч от ан | B44: латупереп | C44: на то, что Юрка все | D44: перепутал | E44: , ― | F44: наоборот по сравнению с Юркой | G44: Я. Е. Харон. Злые песни Гийома дю Вентре (1965) // Я. Харон. Злые песни Гийома дю Вентре. Прозаический комментарий к поэтической биографии, 1989 | H44: Я. Е. Харон | I44: 1914 | J44: Злые песни Гийома дю Вентре | K44: 1965 | L44: публицистика , нехудожественная | M44: мемуары | O44: Я. Харон. Злые песни Гийома дю Вентре. Прозаический комментарий к поэтической биографии | P44: 1989 | Q44: газета | R44: омонимия не снята | S44: Он стал сажать их, как ему представлялось, вверх тормашками, а я ― из тех же намерений, но только с поправкой на то, что Юрка все перепутал, ― наоборот по сравнению с Юркой. [Я. Е. Харон. Злые песни Гийома дю Вентре (1965) // Я. Харон. Злые песни Гийома дю Вентре. Прозаический комментарий к поэтической биографии, 1989] [омонимия не снята] | T44: пере | U44: прошедшее | V44: 3 лицо ед.число | W44: лицо | X44: абстрактный объект | Y44: отсутствует
A45: йуб еишведив ыбокя идюл отч | B45: илатупереп | C45: что люди, якобы видевшие буй, | D45: перепутали | F45: его с обыкновенной медузой, которые | G45: Владимир Саввин. Тайна зеленого буя (2002) // «Коммерсантъ-Власть», 2002.02.26 | H45: Владимир Саввин | J45: Тайна зеленого буя | K45: 2002 | L45: публицистика , нехудожественная | M45: статья | N45: армия и вооруженные конфликты | O45: «Коммерсантъ-Власть» | P45: 2002.02.26 | Q45: журнал | R45: омонимия не снята | S45: Многократные допросы свидетелей показали, что люди, якобы видевшие буй, перепутали его с обыкновенной медузой, которые летом нередко заходят в Баренцево море. [Владимир Саввин. Тайна зеленого буя (2002) // «Коммерсантъ-Власть», 2002.02.26] [омонимия не снята] | T45: пере | U45: прошедшее | V45: 3 лицо мн.число | W45: лицо | X45: неодушувлённый конкретный объект | Y45: лицо
A46: я евтснаитсирх о икчомиС харовогзар | B46: латупереп | C46: разговорах Симочки о христианстве я | D46: перепутал | F46: двух Марий: то, что там | G46: Зоя Масленикова. Разговоры с Пастернаком (2001) | H46: Зоя Масленикова | I46: 1923 | J46: Разговоры с Пастернаком | K46: 2001 | L46: публицистика , нехудожественная | M46: мемуары | O46: Зоя Масленикова. Борис Пастернак. Встречи | P46: 2002 | Q46: книга | R46: омонимия не снята | S46: Сначала он удостоверился, что дверь закрыта, а потом вполголоса сообщил, что в разговорах Симочки о христианстве я перепутал двух Марий: то, что там написано о Марии Магдалине, на самом деле относится к Марии Египетской. [Зоя Масленикова. Разговоры с Пастернаком (2001)] [омонимия не снята] | T46: пере | U46: прошедшее | V46: 3 лицо ед.число | W46: лицо | X46: лицо | Y46: лицо
A47: ен умет ыт | B47: латупереп | C47: [Женя, nick] ты тему не | D47: перепутал | E47: , | F47: ми говорим о СS. | G47: коллективный. Форум: Серверные шутеры. CS 1.6 (2008-2010) | H47: коллективный | J47: Форум: Серверные шутеры. CS 1.6 | K47: 2008-2010 | L47: электронная коммуникация , нехудожественная | M47: форум | N47: досуг, зрелища и развлечения | Q47: электронный текст | R47: омонимия не снята | S47: [Женя, nick] ты тему не перепутал, ми говорим о СS. [коллективный. Форум: Серверные шутеры. CS 1.6 (2008-2010)] [омонимия не снята] | T47: пере | U47: прошедшее | V47: 3 лицо ед.число | W47: лицо | X47: абстрактный объект | Y47: отсутствует
A48: молагуп с оге ыт отч | B48: алатупереп | C48: что ты его с пугалом | D48: перепутала | E48: . | G48: Дарья Донцова. Доллары царя Гороха (2004) | H48: Дарья Донцова | I48: 1952 | J48: Доллары царя Гороха | K48: 2004 | L48: художественная | M48: роман | O48: Дарья Донцова. Доллары царя Гороха | P48: 2004 | Q48: книга | R48: омонимия не снята | S48: ― То-то Дегтярев обрадуется, когда узнает, что ты его с пугалом перепутала. [Дарья Донцова. Доллары царя Гороха (2004)] [омонимия не снята] | T48: пере | U48: прошедшее | V48: 3 лицо ед.число | W48: лицо | X48: лицо | Y48: неодушевлённый конкретный объект
A49: ен мек с ин янем | B49: илатупереп | C49: меня ни с кем не | D49: перепутали | E49: ? | G49: Захар Прилепин. Санькя (2006) | H49: Захар Прилепин | I49: 1975 | J49: Санькя | K49: 2006 | L49: художественная | M49: роман | O49: Захар Прилепин. Санькя | P49: 2006 | Q49: книга | R49: омонимия не снята | S49: ― Вы меня ни с кем не перепутали? [Захар Прилепин. Санькя (2006)] [омонимия не снята] | T49: пере | U49: прошедшее | V49: 3 лицо мн.число | W49: лицо | X49: абстрактный объект | Y49: отсутствует
A50: ано иледиву имас и ым | B50: алатупереп | C50: мы и сами увидели, она | D50: перепутала | F50: все дела, с которыми сама | G50: Н. Н. Берберова. Железная женщина (1978-1980) | H50: Н. Н. Берберова | I50: 1901 | J50: Железная женщина | K50: 1978-1980 | L50: художественная | M50: роман | O50: Н. Берберова. Желещная женщина | P50: 1991 | Q50: книга | R50: омонимия не снята | S50: Это мы и сами увидели, она перепутала все дела, с которыми сама же к нам и обратилась. [Н. Н. Берберова. Железная женщина (1978-1980)] [омонимия не снята] | T50: пере | U50: прошедшее | V50: 3 лицо ед.число | W50: лицо | X50: абстрактный объект | Y50: абстрактный объект
A51: отч ясляоб нО | B51: театупереп | C51: Он боялся, что | D51: перепутает | F51: этот дом с другими, ведь | G51: Мария Рыбакова. Паннония // «Звезда», 2001 | H51: Мария Рыбакова | I51: 1973 | J51: Паннония | K51: 2001 | L51: художественная | M51: повесть | O51: «Звезда» | P51: 2001 | Q51: журнал | R51: омонимия не снята | S51: Он боялся, что перепутает этот дом с другими, ведь он уже убедился, что вовсе не узнавал родные места мгновенно, и даже спустя долгое время все еще сомневался, туда ли он попал. [Мария Рыбакова. Паннония // «Звезда», 2001] [омонимия не снята] | T51: пере | U51: будущее | V51: 2 лицо ед.число | W51: лицо | X51: неодушувлённый конкретный объект | Y51: неодушевлённый конкретный объект

Sheet: префтен
A3: Количество из TENSE | B3: Названия столбцов
A4: Названия строк | B4: будущее | C4: прошедшее | D4: Общий итог
A5: пере | B5: 1 | C5: 24 | D5: 25
A6: с | B6: 7 | C6: 18 | D6: 25
A7: Общий итог | B7: 8 | C7: 42 | D7: 50

Sheet: префпер
A3: Количество из PERSONNUMBER | B3: Названия столбцов
A4: Названия строк | B4: 1 лицо ед.число | C4: 2 лицо ед.число | D4: 3 лицо ед.число | E4: 3 лицо мн.число | F4: Общий итог
A5: пере | C5: 1 | D5: 17 | E5: 7 | F5: 25
A6: с | B6: 1 | C6: 5 | D6: 14 | E6: 5 | F6: 25
A7: Общий итог | B7: 1 | C7: 6 | D7: 31 | E7: 12 | F7: 50

Sheet: префпертен
A3: Количество из PERSONNUMBER | B3: Названия столбцов
A4: Названия строк | B4: будущее | C4: прошедшее | D4: Общий итог
A5: пере | B5: 1 | C5: 24 | D5: 25
A6: 2 лицо ед.число | B6: 1 | D6: 1
A7: 3 лицо ед.число | C7: 17 | D7: 17
A8: 3 лицо мн.число | C8: 7 | D8: 7
A9: с | B9: 7 | C9: 18 | D9: 25
A10: 1 лицо ед.число | B10: 1 | D10: 1
A11: 2 лицо ед.число | B11: 4 | C11: 1 | D11: 5
A12: 3 лицо ед.число | B12: 2 | C12: 12 | D12: 14
A13: 3 лицо мн.число | C13: 5 | D13: 5
A14: Общий итог | B14: 8 | C14: 42 | D14: 50

Sheet: префпар1
A3: Количество из PARTICIPANT1 | B3: Названия столбцов
A4: Названия строк | B4: абстарктные объекты | C4: абстрактное лицо | D4: лицо | E4: неопределённое лицо | F4: Общий итог
A5: пере | D5: 20 | E5: 5 | F5: 25
A6: с | B6: 1 | C6: 8 | D6: 12 | E6: 4 | F6: 25
A7: Общий итог | B7: 1 | C7: 8 | D7: 32 | E7: 9 | F7: 50

Sheet: препар2
A3: Количество из PARTICIPANT2 | B3: Названия столбцов
A4: Названия строк | B4: абстрактный объект | C4: конкретное лицо | D4: лицо | E4: неодушувлённый конкретный объект | F4: отсутствует | G4: Общий итог
A5: пере | B5: 8 | D5: 4 | E5: 8 | F5: 5 | G5: 25
A6: с | B6: 11 | C6: 4 | D6: 2 | E6: 5 | F6: 3 | G6: 25
A7: Общий итог | B7: 19 | C7: 4 | D7: 6 | E7: 13 | F7: 8 | G7: 50

Sheet: префпар3
A3: Количество из PARTICIPANT3 | B3: Названия столбцов
A4: Названия строк | B4: абстрактное лицо | C4: абстрактный объект | D4: конкретное лицо | E4: лицо | F4: неодушевлённый конкретный объект | G4: отсутствует | H4: Общий итог
A5: пере | C5: 3 | E5: 4 | F5: 6 | G5: 12 | H5: 25
A6: с | B6: 1 | C6: 4 | D6: 1 | F6: 3 | G6: 16 | H6: 25
A7: Общий итог | B7: 1 | C7: 7 | D7: 1 | E7: 4 | F7: 9 | G7: 28 | H7: 50

Sheet: график
A3: Количество из Created | B3: Названия столбцов
A4: Названия строк | B4: пере | C4: с | D4: Общий итог
A5: 1952 | C5: 1 | D5: 1
A6: 1957 | C6: 1 | D6: 1
A7: 1960 | C7: 1 | D7: 1
A8: 1962 | C8: 1 | D8: 1
A9: 1965 | B9: 1 | D9: 1
A10: 1966-1970 | B10: 1 | D10: 1
A11: 1967 | B11: 1 | D11: 1
A12: 1971-1974 | C12: 1 | D12: 1
A13: 1973 | C13: 1 | D13: 1
A14: 1978-1980 | B14: 1 | D14: 1
A15: 1979 | B15: 1 | C15: 1 | D15: 2
A16: 1985 | C16: 1 | D16: 1
A17: 1986-1990 | C17: 1 | D17: 1
A18: 1989 | B18: 1 | C18: 2 | D18: 3
A19: 1990-2000 | C19: 1 | D19: 1
A20: 1990-2002 | B20: 1 | D20: 1
A21: 1991-1995 | C21: 1 | D21: 1
A22: 1993 | B22: 1 | D22: 1
A23: 1997 | B23: 2 | D23: 2
A24: 1998 | B24: 2 | C24: 1 | D24: 3
A25: 2000 | B25: 1 | C25: 2 | D25: 3
A26: 2001 | B26: 3 | C26: 2 | D26: 5
A27: 2002 | B27: 2 | C27: 3 | D27: 5
A28: 2003 | B28: 2 | D28: 2
A29: 2004 | B29: 2 | D29: 2
A30: 2006 | B30: 1 | C30: 1 | D30: 2
A31: 2007 | C31: 1 | D31: 1
A32: 2008-2010 | B32: 1 | D32: 1
A33: 2011 | B33: 1 | C33: 1 | D33: 2
A34: 2015 | C34: 1 | D34: 1
A35: Общий итог | B35: 25 | C35: 25 | D35: 50